{"schema_version":1,"recorded_at":"2026-08-22T22:14:27Z","kind":"contract_admission","lane":"commit-contract","hypothesis":"A versioned replayable commit envelope plus durable request-outcome reconstruction can make Cell v0 lost-reply, resolver, log-tag, generation, and quorum invariants executable before a production WAL exists.","parent_commit":"405a6836b6ac7ee7cb2ea3ef816d376c7cb2e986","candidate_commit":"c26c8b13a96e67345efaeccc9707aea038a10322","suite":"cell-commit-contract-v1","suite_hash":"35c5be6bf17f7610527cbb6341d2a9d5ed5488d05ab28922bd59dd8f64d761a6","profile":"sim-dev","backend":"sim-model","seeds":[1103,2207,3301,4409,5519],"run_id":"8dd5c93f-a287-4536-95c5-f6e7497def22","verdict":"keep","primary_metric":{"name":"okv.eval.correctness.anomalies","samples":[0.0,0.0,0.0,0.0,0.0],"median":0.0,"mad":0.0},"hard_gates":"all_passed","negative_controls":{"all_discarded":true,"run_ids":["d7ea4373-f66e-4a97-bd9a-d8c0bbe49607","121b29bf-243d-4c9b-8f58-8ed53614844a","53f2a233-7335-40b8-a75f-9990e9a1a722","a724c2d2-5b0f-4ff1-af80-9c1bcd5fd3f8","a5e32470-82b9-40a3-9245-8ecdc985f9e9","5c44cf51-da36-4999-bbb3-3feb4db3fbaf"]},"telemetry":{"otlp_http":true,"prometheus_metric":"okv_eval_correctness_anomalies_total"},"learned":"Recovery must rebuild both retained client outcomes and the previous committed log-chain head; the envelope must carry replayable conflict and mutation payloads rather than only their digest."}
{"schema_version":1,"recorded_at":"2026-08-22T22:21:31Z","kind":"contract_admission","lane":"htap-exactness","hypothesis":"A logical row oracle can freeze exact base-plus-tail semantics, snapshot retention, and certified-write validation before a DataFusion physical operator exists.","parent_commit":"ca8f695483e103b37aeefa8df6335f1e3b3deed5","candidate_commit":"cfe5f5eb9762c83f079a931d10862bcf9c0856aa","suite":"zebradb-htap-contract-v1","suite_hash":"feec89cd5df4d99cba10b117e343ee59fc70a88ace1d4518256297b6350e1825","profile":"model-dev","backend":"model","seeds":[1103,2207,3301,4409,5519],"run_id":"bd4aec2b-67af-4c69-a7e4-2c53279bd726","verdict":"keep","primary_metric":{"name":"okv.eval.correctness.anomalies","samples":[0.0,0.0,0.0,0.0,0.0],"median":0.0,"mad":0.0},"hard_gates":"all_passed","secondary_metrics":{"exact_checks":30,"tail_rows":35,"tail_bytes":1485,"peak_memory_bytes":384,"spill_bytes":0},"negative_controls":{"all_discarded":true,"run_ids":["c0292f40-9980-4c5c-b319-769005815900","8fae257b-9c68-4f21-beb2-4797795477ff","40e3fa3c-8010-47e0-840e-e45e03edfe55","ee89faa0-3e05-450c-b1cc-baf0690df037","421f6f09-e432-40c8-806f-8236f5f6417e"]},"telemetry":{"otlp_http":true,"prometheus_metrics":["okv_eval_query_result_exact","okv_eval_htap_tail_rows","okv_eval_htap_tail_bytes","okv_eval_htap_peak_memory_bytes","okv_eval_htap_spill_bytes_total"]},"learned":"Invalidation must precede predicate and projection; analytical-tail GC is independent from recovery-WAL pop; an active lease fixes object closure; dependency validation and write must be one serializable transaction."}
{"schema_version":1,"recorded_at":"2026-08-22T22:39:10Z","kind":"contract_admission","lane":"commit-failover","hypothesis":"A versioned checksummed local frame plus per-file synchronization and matching-quorum reconstruction can persist the frozen commit envelope, rebuild retained retry outcomes after fresh opens, and reject unsafe suffixes before a consensus library is selected.","parent_commit":"3e8b98a00efe26a871f929d1cd016e5d2b041f97","candidate_commit":"128d3a52f1b31e1a802792affe635e2f98b38d3b","suite":"persisted-wal-contract-v1","suite_hash":"549d54d686bf363834a7dbb9a0feb4d8a3b6f27bbd633dfcb012f4b0c4a63595","profile":"local-fs","backend":"local-fs","seeds":[1103,2207,3301,4409,5519],"run_id":"71f008a1-3c93-42b9-917a-d0bdafce5a98","verdict":"keep","primary_metric":{"name":"okv.eval.correctness.anomalies","samples":[0.0,0.0,0.0,0.0,0.0],"median":0.0,"mad":0.0},"hard_gates":"all_passed","secondary_metrics":{"events":35,"quorum_appends":10,"recovered_records":35,"reopened_wals":30,"recovered_outcomes":10,"leader_only_attempts":5,"torn_tail_replicas":5,"corruption_failures":5,"maximum_retained_bytes_per_seed":2280},"negative_controls":{"all_discarded":true,"run_ids":["17e00560-dd8a-49df-a812-d79e76a7e739","eb5592a0-45c2-4a94-9beb-8e127d5b835e","f2c25ed8-06a7-4474-ac76-8ee17b23ac02","204274a0-e943-4741-8e67-415062930558","72f3c5c0-4917-4f9c-9ce0-8384098cd1cf","80cd9332-a6d0-4204-8556-224843a6d590"]},"telemetry":{"otlp_http":true,"prometheus_metrics":["okv_eval_correctness_anomalies_total","okv_eval_transaction_commits_total","okv_eval_wal_retained_bytes","okv_eval_availability_success_ratio"]},"learned":"Quorum durability should be reconstructed from matching bytes rather than trusted from a self-declared disk certificate; incomplete final frames may be ignored, while complete corruption without a remaining quorum and envelope-chain disagreement must halt recovery. Consensus, network replication, elections, and independent failure domains remain unproven."}
{"schema_version":1,"recorded_at":"2026-08-22T23:15:02Z","kind":"contract_admission","lane":"commit-failover","hypothesis":"An objectKV-owned append-only per-node journal can satisfy OpenRaft 0.9.25 storage-v2 semantics and recover durable vote, committed position, append, conflicting-suffix truncate, purge, and corruption state across fresh opens before networked consensus exists.","parent_commit":"51f906f522f4379492ede93dc842b79375b356d6","candidate_commit":"02957757462535f53d9ab731e5785f9797bc5d1e","suite":"openraft-storage-contract-v1","suite_hash":"1cc1bbfa47f6a1dd72e3097056f590e420f65b3b13324162b4b24810f5b4cc8e","profile":"local-fs","backend":"local-fs","seeds":[1103,2207,3301,4409,5519],"run_id":"a8a4f9d5-6708-478b-8516-ef6f4fb83f7c","verdict":"keep","primary_metric":{"name":"okv.eval.correctness.anomalies","samples":[0.0,0.0,0.0,0.0,0.0],"median":0.0,"mad":0.0},"hard_gates":"all_passed","secondary_metrics":{"events":40,"reopened_stores":35,"durable_votes":5,"durable_committed_positions":5,"appended_entries":25,"conflict_truncations":5,"purged_prefixes":5,"rejected_log_gaps":5,"torn_tail_repairs":5,"corruption_failures":5,"physical_bytes":3335},"negative_controls":{"all_discarded":true,"run_ids":["57097f78-ea9b-4afd-b1ce-f1740130ff25","b7dc026a-6a1a-4f5f-b3cd-465c21d72ae3","fc747ea7-100b-4e6a-a072-ba840357b2d8","f734c8ba-cb8e-47eb-b2a9-4c7e0ca095ef","2d332837-406d-4f01-aae7-321fd93b1d48","f816a011-d95e-4aa8-881f-4ec00c73523a"]},"telemetry":{"otlp_http":true,"prometheus_metrics":["okv_eval_correctness_anomalies_total","okv_eval_wal_retained_bytes","okv_eval_availability_success_ratio"]},"learned":"The consensus library expects obsolete appends below the durable purge marker to be harmless and same-or-lower retained suffix appends to durably replace that suffix. The objectKV journal can encode both safely while rejecting gaps above the retained log. This admits per-node stable storage only; quorum commit, elections, network faults, generation takeover, and real process crash remain unproven."}
{"schema_version":1,"recorded_at":"2026-08-22T23:40:39Z","kind":"contract_admission","lane":"commit-failover","hypothesis":"Three OpenRaft nodes using objectKV per-node journals and a seeded Turmoil TCP network can preserve quorum-acknowledged commits through leader isolation, successor election, partition repair, stale-suffix replacement, simulated process crash, bounce, and restarted-node catchup.","parent_commit":"82e93b35abb47e1bd177e117974ab6d4e56124ab","candidate_commit":"d77b7b548a30cdc7534f966cd1f0621e977b1561","suite":"openraft-cluster-contract-v1","suite_hash":"e78bf2f4c0c857abc9b2f0aebcbfb25baf03266882ecf1180763ced879f827bb","profile":"local-fs","backend":"turmoil-local-fs","seeds":[1103,2207,3301],"run_id":"ce63ffd2-502b-4418-88c0-f9e7dd6e1599","verdict":"keep","primary_metric":{"name":"okv.eval.correctness.anomalies","samples":[0.0,0.0,0.0],"median":0.0,"mad":0.0},"hard_gates":"all_passed","secondary_metrics":{"checks":24,"committed_writes":9,"elections":9,"stale_write_attempts":3,"stale_write_acks":0,"partitions":6,"repairs":6,"simulated_crashes":3,"simulated_bounces":3,"caught_up_nodes":9,"operation_duration_median_seconds":3.192815084},"negative_controls":{"all_discarded":true,"run_ids":["d61b4196-85e3-449b-b5fb-b764b54d3b88","90aee910-9a0e-4ce2-93bb-96d9019eb97c","6c00a933-1588-4ca8-a341-5f6ac8188c73"]},"telemetry":{"otlp_http":true,"prometheus_metrics":["okv_eval_correctness_anomalies_total","okv_eval_transaction_commits_total","okv_eval_availability_success_ratio"]},"learned":"A single explicit election trigger can arrive before the prior committed-vote lease permits takeover; the deterministic controller must keep the event explicit while retriggering until the recorded successor state is observed. The cluster safely replaces an isolated uncommitted suffix after a higher-term quorum commits. This admits simulated runtime crash and real-journal reopen only; real OS process kill, unsynced-disk loss, generation takeover, and durable request-outcome integration remain unproven."}
{"schema_version":1,"recorded_at":"2026-08-23T00:15:06Z","kind":"contract_admission","lane":"commit-failover","hypothesis":"A versioned request identity and replay-built outcome inside the replicated OpenRaft application history can survive a lost reply, real leader-process kill, successor retry, and killed-node restart without applying the logical command twice.","parent_commit":"26d9d7cf0a0e9b188359a514e8b19800da71dc90","candidate_commit":"cf9a1d17902a04fb8e6577eab804ae622fe3de8a","suite":"openraft-process-contract-v1","suite_hash":"857363533b98dac5dc736e7e1a3d84ac94be6a5936b25e2c63b67c77317132ab","profile":"local-fs","backend":"process-local-fs","seeds":[1103,2207,3301],"run_id":"c4a44d09-08b3-44e4-a3f2-d7077544a85d","verdict":"keep","primary_metric":{"name":"okv.eval.correctness.anomalies","samples":[0.0,0.0,0.0],"median":0.0,"mad":0.0},"hard_gates":"all_passed","secondary_metrics":{"checks":24,"committed_writes":9,"elections":6,"process_starts":12,"process_kills":3,"dropped_replies":3,"duplicate_retries":3,"recovered_outcomes":9,"caught_up_nodes":9,"operation_duration_median_seconds":3.489571875},"negative_controls":{"all_discarded":true,"exact_replay_passed":true,"run_ids":["dc296ac5-1802-437e-a7b6-4c172d72808b","3773ff00-10b9-4cbf-b7bb-4466e8c4e2c6","eb8a76ca-2550-4ba1-a264-f9cce98cd480"]},"telemetry":{"otlp_http":true,"prometheus_metrics":["okv_eval_correctness_anomalies_total","okv_eval_transaction_commits_total","okv_eval_availability_success_ratio"]},"learned":"A durable retry outcome can be rebuilt by replaying the committed log into a fresh state machine, but the eval must wait through the duplicate log index before judging recovered state or it can sample midway through replay. This admits normal TCP and real OS process death; state-machine snapshot persistence, outcome expiry, automatic election, generation takeover, independent-disk loss, and object-store recovery remain unproven."}
{"schema_version":1,"recorded_at":"2026-08-23T01:03:08Z","kind":"contract_admission","lane":"commit-failover","hypothesis":"A replicated external authority plus a data-log fence barrier can move one cell from Active through Fencing and Recovering, reject a preauthorized G1 write ordered after the barrier, survive authority-leader loss, hand the voter set from G1 to G2, and resume with one exact log.","parent_commit":"1e532ed118840cf0278e28fd320971e38469c395","candidate_commit":"42d01507d0d2b7fd77933caf4253b11f164440b3","suite":"generation-takeover-process-v1","suite_hash":"f5596929cae4c2adcfb88197f1996f790ae399372bd49ec1f3be5a46cc79ac27","profile":"local-fs","backend":"process-local-fs","seeds":[1103,2207,3301],"run_id":"d9dac2f8-dc5a-4d94-b177-2275c17fe462","verdict":"keep","primary_metric":{"name":"okv.eval.correctness.anomalies","samples":[0.0,0.0,0.0],"median":0.0,"mad":0.0},"hard_gates":"all_passed","secondary_metrics":{"checks":48,"authority_failovers":3,"membership_changes":3,"committed_data_writes":6,"fenced_commit_rejections":12,"caught_up_nodes":9,"operation_duration_median_seconds":8.838814291},"negative_controls":{"all_discarded":true,"exact_replay_passed":true,"run_ids":["014649d6-23a6-4c5e-82ec-d7cd44da130c","e90f2506-8fcc-48d9-9455-d2aeaa23d106","598bf058-e8c2-4215-bb5a-ff0a55fd727b","149b77de-4ac1-4553-bf95-72adaf3a2182"]},"telemetry":{"otlp_http":true,"prometheus_metrics":["okv_eval_correctness_anomalies_total","okv_eval_transaction_commits_total","okv_eval_availability_success_ratio"]},"learned":"An external linearizable authority read alone has a cross-consensus TOCTOU window. The old transaction system must also commit a replicated data-log fence barrier, and its state machine must reject stale client entries ordered after that barrier before recovery is reserved. This admits a quiesced real-process voter-set takeover. Automatic failure detection, authenticated fence and recovery certificates, control-root reconciliation, coordinator membership change, independent-disk loss, and object-store recovery remain unproven."}
{"schema_version":1,"recorded_at":"2026-08-23T01:32:37Z","kind":"contract_admission","lane":"commit-failover","hypothesis":"Distinct data voters can sign exact locally applied fence and voter-set positions so the external generation authority can reject controller-fabricated recovery evidence before reserving or activating a transaction-system generation.","parent_commit":"2ff2521da748d3f758f219e61141cbe6214fc129","candidate_commit":"6bad3f85f7a51d0ee5844c73de362f47d7477a91","implementation_commits":["ca270a4b98b050e6320ee094ab719d246859fe49","6bad3f85f7a51d0ee5844c73de362f47d7477a91"],"suite":"generation-recovery-certificates-v1","suite_hash":"df8beab6ae44a40a87ea8a5bcdb962b9e63c38a88ca4a488e59a2b999da94213","profile":"local-fs","backend":"process-local-fs","seeds":[1103,2207,3301],"run_id":"6a2989a1-6444-4c87-97ad-e77f16a92475","verdict":"keep","primary_metric":{"name":"okv.eval.correctness.anomalies","samples":[0.0,0.0,0.0],"median":0.0,"mad":0.0},"hard_gates":"all_passed","budget":{"kind":"events","limit":50,"observed":48},"secondary_metrics":{"checks":48,"authority_failovers":3,"membership_changes":3,"committed_data_writes":6,"fenced_commit_rejections":12,"caught_up_nodes":9,"fence_certificate_signers_per_seed":3,"recovery_certificate_signers_per_seed":3,"invalid_certificate_rejections_per_seed":5,"operation_duration_median_seconds":9.704543291},"negative_controls":{"all_discarded":true,"exact_replay_passed":true,"run_ids":["fdb0ca3b-3aad-4bd3-9873-4f7e7f7e1c82","3493a4b7-e583-48ed-9b13-737c008ceaa6","8bd3481e-db0d-49d4-83d6-1ffa4e32dd5e","6acbba16-ac34-433e-b9a1-feeeb2456213","e07e2a22-fce4-418a-921d-818d48441658"]},"telemetry":{"otlp_http":true,"run_id":"e4638e21-f6a0-45b3-abc1-f5aba3467f20","prometheus_metrics":["okv_eval_correctness_anomalies_total","okv_eval_transaction_commits_total","okv_eval_availability_success_ratio"]},"learned":"A signer must attest the exact applied barrier or voter-set transition, not merely a lower position it has applied past. The certificate must bind purpose, cell, generation, recovery identity, active and pending transaction-system identities, membership, and Raft position. Real-process election terms can vary across replays, so the semantic trace normalizes terms while certificate verification still binds the exact observed term. Production key custody, control-root reconciliation, and independent-disk recovery remain unproven."}
{"schema_version":1,"recorded_at":"2026-08-23T02:19:46Z","kind":"contract_admission","lane":"htap-physical-exactness","hypothesis":"A custom DataFusion TableProvider and ExecutionPlan can preserve the frozen exact-snapshot contract across a schema-v1 Parquet base and schema-v2 Arrow tail before streaming or pruning optimizations exist.","parent_commit":"7d326bcb99a7598a00d00221905030c45e823cba","candidate_commit":"4eddce5a138b8143847dbd13701cf12103d4d87d","suite":"zebradb-datafusion-overlay-v1","suite_hash":"0ab2775bb7add8da138c71f55fad62b38e261089dfb87dfff2ac677e911cf44e","profile":"local-fs","backend":"datafusion-local-fs","seeds":[1103,2207,3301],"run_id":"2b487a75-a2c6-4eee-a316-31a557c01899","verdict":"keep","primary_metric":{"name":"okv.eval.correctness.anomalies","samples":[0.0,0.0,0.0],"median":0.0,"mad":0.0},"hard_gates":"all_passed","budget":{"kind":"events","limit":24,"observed":12},"secondary_metrics":{"checks":12,"base_rows":9,"tail_rows":12,"output_rows":9,"tail_bytes":13968,"parquet_bytes":3846,"maximum_materialized_bytes_per_seed":5392},"negative_controls":{"all_discarded":true,"exact_replay_passed":true,"run_ids":["f0bef240-7930-46ef-800f-abc1dc895057","a3a67b85-c411-4636-a45d-66ea09d3ac5a","4fe3f2b8-f138-4622-87a5-54e7497a8e34"]},"telemetry":{"otlp_http":true,"run_id":"4cf2f747-f4b3-4ba4-be8e-e73e3a702c26","prometheus_metrics":["okv_eval_correctness_anomalies_total","okv_eval_query_result_exact_ratio","okv_eval_htap_tail_rows","okv_eval_htap_tail_bytes","okv_eval_htap_peak_memory_bytes","okv_eval_htap_spill_bytes_total"]},"learned":"DataFusion still pushes output projection into a scan when filters remain unsupported, so the provider must add projection above the hidden-column overlay. Its Parquet reader defaults strings to Utf8View, which the v1-to-v2 normalizer must either accept or explicitly disable. DataFusion 54.0 also admits incompatible 54.1 internal crates unless the complete family is lockfile-pinned. The exact physical contract is possible, but this correctness adapter materializes bounded inputs and admits no performance curve yet."}
{"schema_version":1,"recorded_at":"2026-08-23T02:33:18Z","kind":"contract_admission","lane":"publication-gc-correctness","hypothesis":"A transactional publication intent, named immutable-object verification, complete reachability walk, quarantine interval, and delete-time root-domain revalidation can prevent premature visibility and live-object deletion despite unknown PUT outcomes, GC races, counter drift, stale LIST responses, interrupted marks, and root changes.","parent_commit":"8a815e70ed8be3bac06d84d770a0bc0322b31a95","candidate_commit":"2b71dc8a3735b10e0ff94ad593d0c8df3fab21ed","implementation_commits":["9229e9bc4a6a015806754b2fb25431e83f090350","2b71dc8a3735b10e0ff94ad593d0c8df3fab21ed"],"suite":"object-publication-gc-v1","suite_hash":"46b1dfa571454a5d0c0e655c3de9c66a392ab2b5a34897c71fd6e4d443a002da","profile":"model-dev","backend":"publication-gc-model","seeds":[1103,2207,3301,4409,5519],"run_id":"ed897a5f-02c4-4abe-997a-a06ea63bbb8e","verdict":"keep","primary_metric":{"name":"okv.eval.correctness.anomalies","samples":[0.0,0.0,0.0,0.0,0.0],"median":0.0,"mad":0.0},"hard_gates":"all_passed","budget":{"kind":"events","limit":50,"observed":35},"secondary_metrics":{"complete_marks":15,"deferred_deletes":10,"events":35,"incomplete_marks":5,"publication_intents":15,"live_bytes":20160,"object_bytes_written":22720,"object_requests":50,"physical_bytes":20160,"published_roots":15,"reclaimed_objects":5,"verified_unknown_outcomes":5},"negative_controls":{"all_discarded":true,"exact_replay_passed":true,"run_ids":["fcab75f7-617d-4ba7-8226-4ef753c75f01","c03020ca-f858-43e3-8ae8-4ddaa7ab16f3","235eab49-e060-4552-be46-524969f4d788","e0ea8636-4a31-4d08-ad4f-ca0f73de0f31","3ed8b2d5-7868-415c-a8ed-9c1d318ee4e8","0c1512d3-646b-4df9-8cb9-c79fd401273b"]},"telemetry":{"otlp_http":true,"run_id":"09e4760d-c125-41da-bf98-adb816385629","prometheus_metrics":{"okv_eval_correctness_anomalies_total":0,"okv_eval_object_store_bytes_total":22720,"okv_eval_object_store_requests_total":50,"okv_eval_storage_amplification_ratio":1,"okv_eval_availability_success_ratio":1},"signals":["logs","metrics","traces"]},"learned":"An uploaded block needs a transactional in-flight root before GC can race it. Accounting counters and LIST observations cannot determine liveness, a partial mark reclaims nothing, and every delete plan must be revalidated after a root-epoch change. This deterministic model admits the contract only; a real object client, durable transactional authority, independent process failure, and guarded delete worker remain unproven."}
