{"schema_version":1,"recorded_at":"2026-08-23T02:52:32Z","kind":"contract_admission","lane":"htap-streaming-exactness","hypothesis":"A DataFusion execution plan can merge schema-normalized Parquet base rows and Arrow table changes incrementally across arbitrary record-batch boundaries, preserve one target version across independent partition watermarks and continuation, and declare ordered output without materializing either complete input.","parent_commit":"3be7ba15f5c85bb6ce4c6b57bece787ec52689bf","candidate_commit":"95d57b7efc7cae230d1799438c18cd7534cc2c08","suite":"zebradb-datafusion-streaming-v1","suite_hash":"02e8a780d315215303a0586ca2e049a55d5231abee2533a05557e62274f32bc0","profile":"local-fs","backend":"datafusion-local-fs","seeds":[1103,2207,3301],"run_id":"b239a722-8f2e-4250-a2c6-40a253c92088","verdict":"keep","primary_metric":{"name":"okv.eval.correctness.anomalies","samples":[0.0,0.0,0.0],"median":0.0,"mad":0.0},"hard_gates":"all_passed","budget":{"kind":"events","limit":30,"observed":24},"secondary_metrics":{"base_rows":21,"tail_rows":27,"output_rows":21,"input_batches":210,"output_batches":84,"peak_buffered_rows":4,"peak_buffered_bytes":5518,"maximum_group_rows":3,"materialized_input_rows":0,"tail_bytes":52323,"parquet_bytes":14808,"spill_bytes":0,"operation_duration_median_seconds":0.373669958},"negative_controls":{"all_discarded":true,"exact_replay_passed":true,"run_ids":["cfe1db66-4010-41ce-96d8-bc590d428d92","0bba4408-6b51-4728-81a8-8bf5f6ae5450","5c0ca6ba-9b78-47c3-95dc-7f43cf28f963","a1ae7518-ed8b-42fa-b439-70c2a980b6e2","9eda741d-23a4-4eac-b38a-cbdb26acd470"]},"telemetry":{"otlp_http":true,"run_id":"1fa53987-6f78-42c5-8f38-dbe97360df11","prometheus_metrics":{"okv_eval_correctness_anomalies_total":0,"okv_eval_query_result_exact_ratio":1,"okv_eval_htap_tail_rows":9,"okv_eval_htap_tail_bytes":17441,"okv_eval_htap_peak_memory_bytes":5518,"okv_eval_htap_spill_bytes_total":0},"signals":["logs","metrics","traces"]},"learned":"With skewed physical-partition bases, the first exact global identity stream must read the tail from min(W_p), even though that replays changes already reflected in newer bases. Logical-id reduction must cross Arrow batch boundaries, continuation must retain T, and output ordering is safe to declare only after validating both input orders across batches. This admits bounded operator buffering and exactness only; manifest and lease acquisition, multiple execution ranges, partition-aware pruning, full-query memory, and a T-minus-W performance curve remain unproven."}
{"schema_version":1,"recorded_at":"2026-08-23T03:09:07Z","kind":"contract_admission","lane":"publication-adapter-correctness","hypothesis":"A real Apache object_store client plus a separately reopened quorum-fsynced local authority can preserve intent-before-upload, exact closure-before-root, unknown PUT and authority outcomes, complete reachability, and safe unguarded deletion when a durable per-digest reservation serializes publication against sweep.","parent_commit":"d757336d3ac43b12f760d703d061d0dc51cf4828","candidate_commit":"602b3174ca35f4dd1d897767e4aed71d8b111fcd","suite":"object-publication-adapter-v1","suite_hash":"31cbb9a3eec6a6c829ba2bede397750ddac2484e5ffa0a95a9d4bcbe50e6ab00","profile":"local-fs","backend":"object-store-local-fs+authority-quorum-fs","seeds":[1103,2207,3301],"run_id":"e83eeb60-29ab-447d-950c-7b533672cc43","verdict":"keep","primary_metric":{"name":"okv.eval.correctness.anomalies","samples":[0.0,0.0,0.0],"median":0.0,"mad":0.0},"hard_gates":"all_passed","budget":{"kind":"events","limit":48,"observed":48},"secondary_metrics":{"checks":48,"publication_intents":6,"published_roots":6,"authority_reopens":9,"authority_records":24,"verified_unknown_object_outcomes":3,"verified_unknown_authority_outcomes":3,"verified_unknown_delete_outcomes":3,"complete_marks":9,"incomplete_marks":3,"deferred_deletes":3,"delete_reservations":3,"blocked_publications":3,"reclaimed_objects":3,"recreated_objects":3,"object_requests":147,"object_bytes_written":3054,"object_bytes_read":15939,"operation_duration_median_seconds":1.030915958},"negative_controls":{"all_discarded":true,"exact_replay_passed":true,"run_ids":["153211a4-1a87-4afe-af8f-b1bbc9c44f2f","3553fcee-f905-4ae7-97d4-8ac66cceca3c","e32c17a8-5487-4943-8dba-c0f946aa1f1e","978d65a3-fc38-4cce-903d-33dfc8ef36f8","35493197-a5f0-4c2d-a22b-e8a51454a2be","65047123-29e4-4611-bd3a-dcb349bb02ce","21723dc6-a451-41b4-9078-07747cdc3ac8"]},"telemetry":{"otlp_http":true,"run_id":"beaa7904-f2bd-48a8-93e4-3529cb95f98b","prometheus_metrics":{"okv_eval_correctness_anomalies_total":0,"okv_eval_object_store_requests_total":147,"okv_eval_object_store_bytes_read_total":15939,"okv_eval_object_store_bytes_write_total":3054,"okv_eval_availability_success_ratio":1},"signals":["logs","metrics","traces"]},"learned":"Delete-time root revalidation alone is insufficient for backends without native conditional delete. Publication can start after revalidation, verify the old digest object, and race the unguarded delete. A durable per-digest deletion reservation closes that window by rejecting intersecting publication until delete outcome recovery and retirement. The receipt is same-machine and single-process; replicated transaction authority, independent-disk recovery, process kills, provider-native guarded delete, and cloud cost curves remain unproven."}
{"schema_version":1,"recorded_at":"2026-08-23T03:56:02Z","kind":"contract_admission","lane":"publication-authority-correctness","hypothesis":"Publication intents, roots, pins, deletion reservations, and durable request outcomes can share the existing three-node OpenRaft generation authority and survive lost replies, real leader-process death, exact retry, generation transition, and restarted-node replay without exposing a stale or conflicting publication decision.","parent_commit":"2f1d638f02a4693399fae772c305f08fbaa695ea","candidate_commit":"b530321d114728d92741ca9bdfd7b7a637148e75","implementation_commits":["2f1d638f02a4693399fae772c305f08fbaa695ea","b530321d114728d92741ca9bdfd7b7a637148e75"],"suite":"object-publication-authority-process-v1","suite_hash":"0fb1727e6fb6fb8ae0afd12d61ed4e7fe308b8217d4d79baea60be1f33150c21","profile":"local-fs","backend":"process-local-fs","seeds":[1103,2207,3301],"run_id":"550e5585-bf9d-4bc9-b96f-d38aaca9eb49","verdict":"keep","primary_metric":{"name":"okv.eval.correctness.anomalies","samples":[0.0,0.0,0.0],"median":0.0,"mad":0.0},"hard_gates":"all_passed","budget":{"kind":"events","limit":72,"observed":72},"secondary_metrics":{"checks":72,"authority_failovers":6,"process_kills":18,"publication_writes":69,"restarted_nodes":15,"operation_duration_median_seconds":21.304254167},"negative_controls":{"all_discarded":true,"exact_replay_passed":true,"run_ids":["2e863637-114c-4875-aa4e-d99605b1b712","ba980195-fef1-4a39-a609-fa0e3b36eb71","86ca5ee3-5412-4c06-8677-9d85510963c8","57532f21-7b74-4762-8508-490a6f736830","924762f3-3ff2-4583-8826-ed9ae4982f6c","ba99e334-87db-4596-923b-d2ae2910ffb3","7e0a87cd-f127-4a97-bdd4-c60490155f2d","1a1302cc-4508-41b0-9b3e-86a7ed0b78f9","a65fc967-e0b1-4bb1-8fbc-c1507498fd45","7ccd3e9e-9290-49cb-b55a-16731856d1e7"]},"telemetry":{"otlp_http":true,"run_id":"8071bc8a-8a4d-4a29-9118-5a11e22b5e3b","prometheus_metrics":{"okv_eval_correctness_anomalies_total":0,"okv_eval_availability_success_ratio":1,"okv_eval_operation_duration_seconds":21.253080292},"signals":["logs","metrics","traces"]},"learned":"Publication outcome resolution must be linearizable, reader-visible roots and pins need compare-and-swap, and both intents and deletion permits must remain generation-bound in the same replicated state machine. This admits the authority contract only. Publisher and sweeper process death at object-operation boundaries, authority snapshot and outcome expiry, independent-disk loss, provider-native guarded delete, reservation partitioning, and cloud cost curves remain unproven."}
{"schema_version":1,"recorded_at":"2026-08-23T04:28:57Z","kind":"contract_admission","lane":"publisher-process-recovery","hypothesis":"A dedicated publisher process can recover from SIGKILL after quorum-durable Prepare and before the first object PUT, restart with empty scratch, replay the exact canonical job and request identities, verify immutable bytes by named reads, and complete one atomic root publication through the replicated cell authority.","parent_commit":"71065ba12164e85d531750c8f4bd1b8727379423","candidate_commit":"ffc0c849879ec5ac9a54fa556a067c43e414fbe5","suite":"object-publication-publisher-process-v1","suite_hash":"c85d0997ad3cc82ac4ccf1e493fef6d8f3c42e490c3bfd54c2d5c9ce4e1079a8","profile":"local-fs","backend":"object-store-local-fs+process-openraft","seeds":[1103,2207,3301],"run_id":"3b5cb41f-8985-47f4-8e87-4797ad9babef","verdict":"keep","primary_metric":{"name":"okv.eval.correctness.anomalies","samples":[0.0,0.0,0.0],"median":0.0,"mad":0.0},"hard_gates":"all_passed","budget":{"kind":"events","limit":30,"observed":30},"secondary_metrics":{"checks":30,"authority_process_starts":9,"publisher_process_starts":6,"process_kills":3,"object_puts":9,"operation_duration_median_seconds":1.410347708},"negative_controls":{"all_discarded":true,"exact_replay_passed":true,"run_ids":["26bde1fa-670b-40db-a750-8f363042b10b"],"anomaly_samples":[8.0,8.0,8.0]},"semantic_receipts":{"seed_1103_trace_sha256":"4708c69fc32f5d1d2c6ecf867cacc8944aa69f43737d629bf2372962b21d185a","fresh_trace_file_sha256":"ff9be1de03017e677347f98cb2f8d2c033f5ccb836322ffc66f257f8d26f154a"},"telemetry":{"otlp_http":true,"run_id":"ce7692da-7150-4b6a-81c4-9e680c7e2bb6","prometheus_metrics":{"okv_eval_correctness_anomalies_total":0,"okv_eval_availability_success_ratio":1,"okv_eval_operation_duration_seconds":1.372828},"signals":["logs","metrics","traces"]},"learned":"Durable publication state is sufficient to restart a publisher without a worker-local journal at the first effect boundary. The immutable job and transition identities must be derived from canonical bytes, and the controller must prove both the replicated Prepare outcome and object absence before killing the first worker. Partial uploads, lost object or Publish replies, abandoned intents, sweeper receipts, object-effect fencing, authority snapshot repair, and cloud semantics remain unproven."}
{"schema_version":1,"recorded_at":"2026-08-23T04:48:58Z","kind":"contract_admission","lane":"publisher-put-recovery","hypothesis":"A publisher can recover from SIGKILL after an immutable data-object PUT takes effect but its response becomes retryable-unknown, restart with empty scratch, recover the canonical job from quorum-durable intent, verify the existing named object exactly, complete the closure, and publish one atomic root.","parent_commit":"b7a473ec9beb1b7fc5e2047c7d1efa12a30d7805","candidate_commit":"a6dfeed13af06d56c30d494d751866bfbdf03a27","suite":"object-publication-publisher-put-recovery-v1","suite_hash":"3fb4011ccaf83b5af0eb027174e79a4d710be6665d1592115df67122744b6dbd","profile":"local-fs","backend":"object-store-local-fs+process-openraft","seeds":[1103,2207,3301],"run_id":"a4a1aec5-cca9-46e7-864e-de48a7e2c30b","verdict":"keep","primary_metric":{"name":"okv.eval.correctness.anomalies","samples":[0.0,0.0,0.0],"median":0.0,"mad":0.0},"hard_gates":"all_passed","budget":{"kind":"events","limit":36,"observed":36},"secondary_metrics":{"checks":36,"authority_process_starts":9,"publisher_process_starts":6,"process_kills":3,"put_attempts":12,"object_effects":9,"injected_unknown_responses":3,"existing_object_recoveries":3,"named_verification_reads":18,"publication_command_attempts":9,"empty_scratch_restarts":3,"operation_duration_median_seconds":1.373551458},"negative_controls":{"all_discarded":true,"exact_replay_passed":true,"run_ids":["fa9d729b-c861-444a-9989-7127f026058c"],"anomaly_samples":[4.0,4.0,4.0]},"semantic_receipts":{"seed_1103_trace_sha256":"4fc56ca8a4e9273f29188939679b96783cf44870ef7caecec6b8840599af2a57","fresh_trace_file_sha256":"76fe7863c59c319a388d7dfd25921006cbe86967e798fe297e3bddc577944dd4"},"telemetry":{"otlp_http":true,"run_id":"b57f141f-fd8d-4108-b053-da1c2cc9a63d","prometheus_metrics":{"okv_eval_correctness_anomalies_total":0,"okv_eval_availability_success_ratio":1,"okv_eval_operation_duration_seconds":1.39638825},"collector":{"log_records":2,"trace_spans":1,"metrics":8,"metric_data_points":8},"signals":["logs","metrics","traces"]},"learned":"An unknown object-write response must remain uncertain until exact named identity resolves it. Replicated intent plus deterministic immutable names is sufficient to restart without a worker-local journal, but root publication must remain after a full closure walk. Lost manifest and Publish replies, repeated unknown responses, multipart residue, abandoned-intent reassignment, sweeper recovery, generation-bound effect grants, independent-disk loss, and cloud semantics remain unproven."}
{"schema_version":1,"recorded_at":"2026-08-23T04:58:51Z","kind":"contract_admission","lane":"publisher-manifest-recovery","hypothesis":"A publisher can recover from SIGKILL after the immutable manifest PUT takes effect but its response becomes retryable-unknown, restart with empty scratch, recover the canonical job from quorum-durable intent, verify every data object and the manifest by exact named identity, walk the complete closure, and publish one atomic root.","parent_commit":"2e332de600d7c305d36b6aec7ed2eab022e4f58a","candidate_commit":"57e28d4e58b1ed2aebebd87e2d3504dbe4ded090","suite":"object-publication-publisher-manifest-recovery-v1","suite_hash":"c0d0bc9577706568de07781211486b297d07b6f57f7cae226c760805f4219e77","profile":"local-fs","backend":"object-store-local-fs+process-openraft","seeds":[1103,2207,3301],"run_id":"2660e09d-e2f3-4482-a123-68024779de1a","verdict":"keep","primary_metric":{"name":"okv.eval.correctness.anomalies","samples":[0.0,0.0,0.0],"median":0.0,"mad":0.0},"hard_gates":"all_passed","budget":{"kind":"events","limit":39,"observed":39},"secondary_metrics":{"checks":39,"authority_process_starts":9,"publisher_process_starts":6,"process_kills":3,"put_attempts":18,"object_effects":9,"injected_unknown_responses":3,"existing_object_recoveries":9,"named_verification_reads":24,"publication_command_attempts":9,"empty_scratch_restarts":3,"operation_duration_median_seconds":1.447766208},"negative_controls":{"all_discarded":true,"exact_replay_passed":true,"run_ids":["7ace2812-aab0-44be-bacc-9f4f992d014c"],"anomaly_samples":[4.0,4.0,4.0]},"semantic_receipts":{"seed_1103_trace_sha256":"ed595fbbc3e45353be139239b1823ca2470170ff8d4ba38ea89ea39f09e32f90","fresh_trace_file_sha256":"bfea85545e9d48619e1be13a92c98f4e0fa1718824841e9e64948dab385da02b"},"telemetry":{"otlp_http":true,"run_id":"5fd6240e-17e8-4fca-b632-c594170a233c","prometheus_metrics":{"okv_eval_correctness_anomalies_total":0,"okv_eval_availability_success_ratio":1,"okv_eval_operation_duration_seconds":1.4893435},"collector":{"log_records":2,"trace_spans":1,"metrics":8,"metric_data_points":8},"signals":["logs","metrics","traces"]},"learned":"Manifest identity authenticates only manifest bytes. It does not prove child presence. A replacement can recover safely from replicated intent and deterministic immutable names, but it must replay data identities and walk the complete named closure before requesting visibility. Lost Publish replies, repeated unknown responses, multipart residue, abandoned-intent reassignment, sweeper recovery, generation-bound effect grants, independent-disk loss, and cloud semantics remain unproven."}
{"schema_version":1,"recorded_at":"2026-08-23T05:27:25Z","kind":"contract_admission","lane":"publisher-publish-recovery","hypothesis":"A publisher can recover after its replicated Publish command applies but its response is lost, then the publisher and accepting authority leader die, by reconstructing the stable job and request identity from empty scratch, resolving the quorum-durable outcome on a successor, and retrying without a second authority or object effect.","parent_commit":"2c6a2ab78d34007efdf700986a46b01537cf1982","candidate_commit":"72df70c726797ff3ff7dcd0642a89e2302a7fd7e","suite":"object-publication-publisher-publish-recovery-v1","suite_hash":"4e27af680040ba4b08914b299058da4e046d5f20f95b4d420be202604ede579a","profile":"local-fs","backend":"object-store-local-fs+process-openraft","seeds":[1103,2207,3301],"run_id":"a544deff-edec-4885-a0bf-b1217d720328","verdict":"keep","primary_metric":{"name":"okv.eval.correctness.anomalies","samples":[0.0,0.0,0.0],"median":0.0,"mad":0.0},"hard_gates":"all_passed","budget":{"kind":"events","limit":42,"observed":42},"secondary_metrics":{"checks":42,"authority_process_starts":9,"publisher_process_starts":6,"process_kills":6,"authority_failovers":3,"object_put_attempts":9,"object_effects":9,"named_verification_reads":45,"publish_command_attempts":6,"publish_applies":3,"dropped_publish_replies":3,"recovered_publish_outcomes":3,"exact_outcome_replays":3,"empty_scratch_restarts":3,"operation_duration_median_seconds":4.78356025},"negative_controls":{"all_discarded":true,"exact_replay_passed":true,"run_ids":["82698bdb-443d-4ad7-830f-5bef6927b8f8"],"anomaly_samples":[4.0,4.0,4.0],"final_root_and_closure_exact":true,"publish_applies_per_seed":2,"recovered_outcomes":0},"semantic_receipts":{"seed_1103_trace_sha256":"0f63f452209671930726648dde68aeea44441b4fcef08f465c7d843c8dbb7757","fresh_trace_file_sha256":"e75218f48e39ecad6614f62da9ede8f59984b9de67829cda1525ea033ccea9e6"},"telemetry":{"otlp_http":true,"run_id":"50ad5d86-ee3e-4790-9c19-d81383d68002","prometheus_metrics":{"okv_eval_correctness_anomalies_total":0,"okv_eval_availability_success_ratio":1,"okv_eval_operation_duration_seconds":3.723415042},"collector":{"log_records":2,"trace_spans":1,"metrics":8,"metric_data_points":8},"signals":["logs","metrics","traces"]},"learned":"A matching current root and complete object closure do not identify the outcome of the original Publish invocation. Safe crash recovery requires a replicated command receipt keyed by a stable identity, exact fingerprint validation, and retry that returns the original applied position without a second state transition. Retained-outcome expiry and snapshot restoration, repeated lost replies, later-root supersession, generation handoff, multipart residue, independent-disk loss, and cloud semantics remain unproven."}
{"schema_version":1,"recorded_at":"2026-08-23T05:50:06Z","kind":"contract_admission","lane":"slatedb-filesystem-incumbent","hypothesis":"Pinned SlateDB can establish a correctness-gated local physical incumbent for deterministic ingest, point reads, ordered scans, and fresh-instance reopen while recording backend requests and bytes through the shared eval and OTel contracts.","parent_commit":"e13f655b2ee8affc8febdb815732beb0812386cd","candidate_commit":"12df9f83df25decd664907b214fb95757c50956f","implementation_commits":["e13f655b2ee8affc8febdb815732beb0812386cd","12df9f83df25decd664907b214fb95757c50956f"],"suite":"phase0-slate-filesystem-v1","suite_hash":"7f7c5465711cc52ce4d326e6046bc98a0555ee2366f120239beb684c9ae0b41e","profile":"local-fs","backend":"slatedb-local-fs","seeds":[1103,2207,3301],"run_id":"84410878-5ee2-4405-8ebb-7131780b5479","verdict":"keep","primary_metric":{"name":"okv.eval.recovery.first_correct_read_duration","samples":[0.110013167,0.129935667,0.134431042],"median":0.129935667,"mad":0.004495375},"hard_gates":"all_passed","budget":{"kind":"seconds","limit":60,"observed":11.102947292},"secondary_metrics":{"correctness_anomalies":0,"object_store_requests":794,"object_store_read_bytes":17120801,"object_store_written_bytes":53028027},"negative_controls":{"all_discarded":true,"run_ids":["e53a01c4-c687-4663-823d-2d15f6136a77"],"failed_gate":"fresh_db_cache_on_reopen","logical_result_exact":true,"poisoned_reopen_median_seconds":0.00005325},"semantic_receipts":{"logical_receipt_sha256":"5a177deb6f11cda284715526b515870130ddfbe46770cbad911573405e74cfce"},"telemetry":{"otlp_http":true,"run_id":"794c45da-0b6e-4566-9260-2e643810a23f","prometheus_metrics":{"okv_eval_correctness_anomalies_total":0,"okv_eval_object_store_requests_total":792,"okv_eval_object_store_bytes_read_total":17120801,"okv_eval_object_store_bytes_write_total":53028027,"okv_eval_recovery_first_correct_read_duration_seconds_median":0.119343333},"collector":{"log_records":2,"trace_spans":67,"metrics":14,"metric_data_points":40},"signals":["logs","metrics","traces"]},"learned":"A fresh-instance reopen was roughly three orders of magnitude slower than a warm-instance read, so cache state must remain a hard gate. The local incumbent is directionally useful but not a product verdict: raw backend calls include expected absence and conditional-operation failures, compaction is not forced, and remote S3, GCS, scale, and named cost ceilings remain unmeasured."}
