{"schema_version":1,"recorded_at":"2026-08-26T08:36:34Z","kind":"diagnostic_scale","lane":"empty-worker-recovery","supersedes_suite_hash":"9f37becf9dd7d3ae7e574f92dc49d2fecf5ef28b7cae68f13d5534861e378056","hypothesis":"As one assigned range grows from 1 MiB to 64 MiB, an empty serving worker can keep its first exact point read to one manifest GET, one selected-index GET, and one data range GET without full range hydration.","candidate_commit":"a56442ad800deedd72a404a0886e88831eb308a0+dirty","suite":"objectkv-product-thesis-physical-v1","suite_hash":"4f28c333e7fdfed2d6f759b698c71ab0d9d3b3695c61e77b6b5503d735a0065e","profiles":["recovery-1mib-dev","recovery-8mib-dev","recovery-dev"],"profile_hash":"1d8fd0b5a7fc9e044b7928cb55a7c0a0f2af6ce2493684f5af4e8e506225fcfa","backend":"apache-object-store-local-fs","build":"release","seeds":[1103,2207,3301],"repeats_per_seed":5,"run_ids":{"1mib":{"candidate":"f33c390e-10c8-4c07-b563-cbc8ab217321","full_restore_control":"c95c5c22-3f23-4fb7-af93-e9bfa25c3bc5","hydration_poison":"243c235a-a1c1-4964-b2a8-4d9acfc1bf6c"},"8mib":{"candidate":"b247645a-3ac0-4863-83f9-12c60554b365","full_restore_control":"4a3fa57f-ec4c-46fa-8b56-eff83cc35829","hydration_poison":"41e534ae-619d-400c-afd4-a0390cb07d32"},"64mib":{"candidate":"c7c9c387-90bc-4be0-bfe0-1c98508010cb","full_restore_control":"06df7444-9439-4d64-81d3-68410b52e371","hydration_poison":"86cb6ff9-bf4e-45b3-8afb-cf39f161120e"}},"verdict":"inconclusive","primary_metric":{"name":"okv.eval.recovery.first_correct_read_duration","statistic":"p99","candidate_seconds":[0.000490916,0.000493583,0.000506459],"full_restore_control_seconds":[0.005261042,0.02426875,0.13983925]},"hard_gates":{"candidate":"all_passed_at_all_sizes","full_restore_control":"all_passed_at_all_sizes","hydration_poison":"discarded_at_all_sizes","semantic_correctness_preserved":true},"measurements":[{"logical_bytes":1048576,"segments":1,"complete_closure_bytes":1076586,"candidate_response_bytes":67288,"candidate_p50_seconds":0.0003105,"candidate_p99_seconds":0.000490916,"full_restore_p50_seconds":0.004244958,"full_restore_p99_seconds":0.005261042,"full_restore_p99_over_candidate":10.7167865786},{"logical_bytes":8388608,"segments":3,"complete_closure_bytes":8608555,"candidate_response_bytes":72571,"candidate_p50_seconds":0.000300375,"candidate_p99_seconds":0.000493583,"full_restore_p50_seconds":0.023797458,"full_restore_p99_seconds":0.02426875,"full_restore_p99_over_candidate":49.1685288999},{"logical_bytes":67108864,"segments":17,"complete_closure_bytes":68862678,"candidate_response_bytes":80018,"candidate_p50_seconds":0.000329792,"candidate_p99_seconds":0.000506459,"full_restore_p50_seconds":0.136813875,"full_restore_p99_seconds":0.13983925,"full_restore_p99_over_candidate":276.111689199}],"negative_controls":{"all_discarded":true,"class":"full_range_hydration_before_first_read","failed_gates":["workload_execution","one_selected_index_get","one_data_range_get_without_hydration","selected_metadata_and_block_byte_bound"]},"semantic_receipts":{"1mib_candidate_sha256":"a135e95a5e33d2c84af769ddfa4974b9ac6fca889819950a6532dd53893a3dd3","1mib_control_sha256":"6d2912e6de5c247ddcf2305d096c1db0d40f8505b742bad00e79f6226daaba8c","1mib_poison_sha256":"164a6d680425c36d318f0e2f867cd0510ac268ac5e20a6cb967e65187c37fc8a","8mib_candidate_sha256":"c8569c979e39baef7f9303dd95d94300b26f9438f54c508d18e28a3fe0cb3346","8mib_control_sha256":"334e916a7f724164da3b21bcb30661841cfd8aa0d503264cd414923e6e28a0ad","8mib_poison_sha256":"a15b16a93a3ae2d02992cf7ef6220d293d3fb593b3159c97d35de7ef482fb125","64mib_candidate_sha256":"1113f3b1b9c1c860425331aa325dfb48b5a2cd3083d81c16a45a8a3461c51d1e","64mib_control_sha256":"68f7c1cb828896fea4f80d4daefb14ef2eb5e1360312a2b134ddead8fed3d301","64mib_poison_sha256":"2c32685c30428ef05b0e9cb1bc3b8641f04d0a9f9e8df0413cd72754b7bd4656"},"telemetry":{"otlp_http":false,"reason":"dirty local diagnostic"},"learned":"Across a 63.96x complete-closure increase, lazy first-read response bytes grew 1.19x and p99 grew 1.03x, while full restore grew with closure and was 276.11x slower at 64 MiB. The manifest-first selected-index path is locally implementable. Cloud latency, process replacement, authoritative root open, txLog replay, scans, concurrency, clean-source reproducibility, OTel, and cost remain unproven."}
{"schema_version":1,"recorded_at":"2026-08-26T09:05:41Z","kind":"diagnostic_process_recovery","lane":"serving-worker-process-recovery","hypothesis":"After a serving process is killed, a distinct empty-scratch replacement can discover the replicated authoritative row root and logical txLog root, quorum-recover a non-empty suffix, and return exact base and tail reads without complete range hydration.","candidate_commit":"a56442ad800deedd72a404a0886e88831eb308a0+dirty","suite":"serving-worker-process-recovery-v1","suite_hash":"9fefba95a605b3996cd3f96de082d54f059798cee6d55aa9db44732310027e7b","profile":"local-fs","profile_hash":"323da6392297933a4aff5595ac5e34068707f9e62bf8be3756f6f1009dddfcea","backend":"object-store-local-fs+authority-openraft+quorum-wal-files","build":"release","seeds":[1103,2207,3301],"run_ids":{"candidate":"45902c4b-4f28-446a-99c6-017a0d874f54","full_hydration_control":"a70d6132-8c7c-4bc6-842f-628d6606ec8d","skip_tail_poison":"56f2519e-8320-4522-bb4a-4d79243ce47f"},"verdict":"inconclusive","primary_metric":{"name":"okv.eval.recovery.first_correct_read_duration","candidate_p99_seconds":0.006350333,"candidate_samples_seconds":[0.005930583,0.006350333,0.006330875],"full_hydration_p99_seconds":0.010589375,"full_hydration_samples_seconds":[0.010021042,0.010589375,0.010176416],"skip_tail_poison_p99_seconds":0.006500375},"hard_gates":{"candidate":"all_passed","full_hydration_control":"all_passed","skip_tail_poison":"discarded","exact_base_update_delete_insert":true,"stable_generation_publication_generation_read":true,"real_process_kill_and_empty_replacement":true,"non_empty_quorum_txlog_suffix":true,"bounded_named_object_reads":true,"semantic_replay_exact":true},"secondary_metrics":{"candidate_correctness_anomalies":0,"control_correctness_anomalies":0,"poison_correctness_anomalies":9,"candidate_object_response_bytes_median":35811,"control_object_response_bytes_median":1072772,"row_data_closure_bytes":1066354,"row_segments":5,"txlog_physical_bytes_median":16158,"authority_processes_per_seed":3,"worker_process_starts_per_seed":2,"worker_process_kills_per_seed":1,"replacement_empty_scratch_per_seed":1,"candidate_manifest_gets_per_seed":1,"candidate_index_gets_per_seed":1,"candidate_range_gets_per_seed":1,"candidate_complete_gets_per_seed":0,"candidate_list_operations_per_seed":0},"ratios":{"full_hydration_p99_over_candidate":1.6675306634,"candidate_p99_reduction_fraction":0.400311,"control_bytes_over_candidate":29.9564938148,"candidate_bytes_over_data_closure":0.0335826757},"negative_controls":{"all_discarded":true,"class":"skip_tail_replay","required_tail_applied_per_seed":0,"correct_base_read_per_seed":true,"incorrect_update_delete_insert_per_seed":true},"semantic_receipts":{"candidate_sha256":"e7d07e911eba06df707c4092cc58fdfccf8f18691fafca63fe81347d5d7b031f","control_sha256":"49e82ff4dfa3f4498e6a2e9bf0d732010105c655b7d1ec91ea4c73d9f2c2c021","poison_sha256":"908132b21e5947a7ba11ee747ef1a1eb408673e0e852905d050a32546de0e877"},"telemetry":{"otlp_http":false,"reason":"dirty local diagnostic"},"learned":"The object-base plus durable-tail recovery equation is executable across an operating-system process kill and a distinct empty-scratch replacement. The candidate used one manifest, one index, one range GET, and 3.36 percent of the encoded closure, while full hydration was 1.67x slower at p99 and transferred 29.96x more bytes. Skipping the required tail produced nine anomalies. The local three-file adapter is not the production OpenRaft data txLog; independent hosts, concurrent catch-up, range semantics, cloud latency, clean-source admission, and economics remain open."}
{"schema_version":1,"recorded_at":"2026-08-26T09:17:00Z","kind":"diagnostic_process_recovery_supersession","lane":"serving-worker-process-recovery","supersedes_suite_hash":"9fefba95a605b3996cd3f96de082d54f059798cee6d55aa9db44732310027e7b","supersession_reason":"Promoting RFC-0026 and the suite to evaluating changed the frozen contract bytes after the preliminary v1 receipts. The v2 run binds the same implementation and seeds to the exact current contract hash.","hypothesis":"After a serving process is killed, a distinct empty-scratch replacement can discover the replicated authoritative row root and logical txLog root, quorum-recover a non-empty suffix, and return exact base and tail reads without complete range hydration.","candidate_commit":"a56442ad800deedd72a404a0886e88831eb308a0+dirty","suite":"serving-worker-process-recovery-v1","suite_hash":"bc6db938e667a83a3b1ed0dd7d714d4f97680c1bd47757e3d0acef878bb90075","profile":"local-fs","profile_hash":"323da6392297933a4aff5595ac5e34068707f9e62bf8be3756f6f1009dddfcea","backend":"object-store-local-fs+authority-openraft+quorum-wal-files","build":"release","seeds":[1103,2207,3301],"run_ids":{"candidate":"6a746a4d-0216-4591-bd54-662158ad9982","full_hydration_control":"16c7f4eb-63ab-4a98-9050-35deae6fac18","skip_tail_poison":"78fbc21a-d320-4f60-b4e5-535c15dcb911"},"verdict":"inconclusive","primary_metric":{"name":"okv.eval.recovery.first_correct_read_duration","statistic":"p99","candidate_seconds":0.006542209,"candidate_samples_seconds":[0.006044042,0.006542209,0.005777084],"full_hydration_seconds":0.010965,"full_hydration_samples_seconds":[0.00798775,0.010965,0.00878],"skip_tail_poison_seconds":0.006236833},"hard_gates":{"candidate":"all_passed","full_hydration_control":"all_passed","skip_tail_poison":"discarded","exact_base_update_delete_insert":true,"stable_generation_publication_generation_read":true,"real_process_kill_and_empty_replacement":true,"non_empty_quorum_txlog_suffix":true,"bounded_named_object_reads":true,"semantic_replay_exact":true},"secondary_metrics":{"candidate_correctness_anomalies":0,"control_correctness_anomalies":0,"poison_correctness_anomalies":9,"candidate_object_response_bytes_median":35811,"control_object_response_bytes_median":1072772,"row_data_closure_bytes":1066354,"row_segments":5,"txlog_physical_bytes_median":16158,"authority_processes_per_seed":3,"worker_process_starts_per_seed":2,"worker_process_kills_per_seed":1,"replacement_empty_scratch_per_seed":1,"candidate_manifest_gets_per_seed":1,"candidate_index_gets_per_seed":1,"candidate_range_gets_per_seed":1,"candidate_complete_gets_per_seed":0,"candidate_list_operations_per_seed":0},"ratios":{"full_hydration_p99_over_candidate":1.67604,"candidate_p99_reduction_fraction":0.403355,"control_bytes_over_candidate":29.9565,"candidate_bytes_over_data_closure":0.0335827},"negative_controls":{"all_discarded":true,"class":"skip_tail_replay","required_tail_applied_per_seed":0,"correct_base_read_per_seed":true,"incorrect_update_delete_insert_per_seed":true},"semantic_receipts":{"candidate_sha256":"1de29968596e89393b1bf5dcdee4a62930b41549e5b5ac512f47a3e37e052784","control_sha256":"f89bc10121dda3dfb0c05b6ccce5b86302fa50b1901e938270e192a38752b735","poison_sha256":"575da85124c3117a4a8f16cd5f85c6ff06efa4e380b1bbeb27e0bf841ded5c35"},"telemetry":{"otlp_http":false,"reason":"dirty local diagnostic"},"learned":"The current contract reproduces the object-base plus durable-tail recovery result across an operating-system process kill and a distinct empty-scratch replacement. The lazy path was 1.68x faster at p99 and moved 29.96x fewer object bytes than full hydration. Skipping the tail produced nine anomalies. The local three-file adapter is not the production OpenRaft data txLog; independent hosts, concurrent catch-up, range semantics, cloud latency, clean-source admission, and economics remain open."}
{"schema_version":1,"recorded_at":"2026-08-26T09:37:38Z","kind":"diagnostic_supersession","lane":"serving-worker-openraft-recovery","suite":"serving-worker-openraft-recovery-v1","suite_hash":"ed8b564b9baad15b631cc8c5d790aac2d0a6977c0e37e62afd29e5303af0190d","candidate_commit":"a56442ad800deedd72a404a0886e88831eb308a0+dirty","run_ids":{"candidate":"d721e5ba-6b59-48cc-9a7d-066bd547cb4f","full_hydration_control":"0230681a-894b-49e4-a564-3cadfe7177ff","skip_concurrent_catchup_poison":"5d9dfbbe-e30a-4694-a430-1054be9b30d1"},"verdict":"superseded","supersession_reason":"The first implementation started recovery.first_correct_read_duration after catch-up and optional full hydration. Those receipts measured only final point reads and do not satisfy the metric contract. The v2 timer begins at worker-process entry."}
{"schema_version":1,"recorded_at":"2026-08-26T09:39:07Z","kind":"diagnostic_process_recovery","lane":"serving-worker-openraft-recovery","hypothesis":"A distinct empty-scratch replacement worker can reconstruct ObjectState(O) plus an authority-owned OpenRaft retained transaction stream through a frozen target, then perform a second bounded catch-up while commits continue without reading physical Raft journal paths.","candidate_commit":"a56442ad800deedd72a404a0886e88831eb308a0+dirty","suite":"serving-worker-openraft-recovery-v1","suite_hash":"70f61d8b6cb986f2389353ba816da44654b58ec5e6fa60002852a01ae1cc1452","profile":"local-fs","profile_hash":"970724f223923a5166274284d9dabf14647b9e5aae8b90eff7dced98a113355c","backend":"object-store-local-fs+authority-openraft+data-openraft","build":"debug","seeds":[1103,2207,3301],"run_ids":{"candidate":"ad0931e6-fca0-4d58-8e70-12f7454ea768","full_hydration_control":"e47ab6c6-c8f8-4bf4-aa03-cc4ddc33c324","skip_concurrent_catchup_poison":"ad6ae3ba-1df9-44b9-9f65-906d40bbe146"},"verdict":"inconclusive","primary_metric":{"name":"okv.eval.recovery.first_correct_read_duration","statistic":"p99","candidate_seconds":0.120183416,"candidate_samples_seconds":[0.111197708,0.11311125,0.120183416],"full_hydration_seconds":0.197673791,"full_hydration_samples_seconds":[0.197673791,0.1753385,0.170567541],"skip_concurrent_catchup_poison_seconds":0.176149833},"hard_gates":{"candidate":"all_passed","full_hydration_control":"all_passed","skip_concurrent_catchup_poison":"discarded","authority_processes":6,"worker_process_starts":2,"worker_process_kills":1,"catchup_rounds":2,"concurrent_commits":4,"physical_raft_journal_path_accesses":0,"exact_set_clear_insert_and_clear_range":true,"semantic_replay_exact":true},"secondary_metrics":{"candidate_correctness_anomalies":0,"control_correctness_anomalies":0,"poison_correctness_anomalies":12,"candidate_object_response_bytes_median":6177,"control_object_response_bytes_median":42305,"candidate_txlog_response_payload_bytes_median":3854,"row_data_closure_bytes":39288,"row_index_closure_bytes":1374,"row_segments":3,"object_durable_version":9,"initial_target_version":12,"activation_target_version":16,"txlog_read_requests":4},"ratios":{"full_hydration_p99_over_candidate":1.64477,"control_bytes_over_candidate":6.84879,"candidate_bytes_over_object_closure":0.151911},"negative_controls":{"all_discarded":true,"class":"skip_concurrent_catchup","concurrent_records_observed_per_seed":4,"concurrent_records_applied_per_seed":0,"anomalies_per_seed":4},"semantic_receipts":{"candidate_sha256":"4bc41772860d30fef896def76df05d5e7c8206851231451bd0d03b3a427bc7e5","control_sha256":"c7857115d0537946c1d67c5b55fa0835ad6f71baacc738423f6971c9b15b3354","poison_sha256":"5dd162fa70dabf99247cf9f11a27b2c7b769f1e997c1125dd4df914651549a54"},"telemetry":{"otlp_http":false,"reason":"dirty local diagnostic"},"learned":"The recovery seam no longer depends on LocalReplicatedWal or a physical OpenRaft journal path. A linearizable paginated state-machine stream preserved exact target snapshots across Raft index gaps and a second catch-up round. Candidate recovery was 1.64x faster at p99 and moved 6.85x fewer object bytes than full hydration on this 39 KiB local closure. This does not prove safe-pop, bounded retained bytes, independent-machine durability, GCS behavior, overload convergence, serving-lease activation, release performance, OTel, or production economics."}
{"schema_version":1,"recorded_at":"2026-08-26T10:33:11Z","kind":"diagnostic_strategy_falsifier","lane":"transaction-authority-state-scale","hypothesis":"At fixed live key cardinality and ideal objectification O=C, removing the complete retained recovery stream is sufficient to keep the current serialized transaction-authority state within 2x growth from 256 to 4096 lifetime commits.","candidate_commit":"a56442ad800deedd72a404a0886e88831eb308a0+dirty","suite":"transaction-authority-state-scale-v1","suite_hash":"5b456689111ca650513079c3557ba675e0b8180f8dba5d5075100c9bfd1e4279","profile":"local-process","profile_hash":"88db504c95031579d0e4269919f0b85cd8d29cc8fc5e61539e23d1821bbd256d","backend":"data-openraft-local-process","build":"debug","seeds":[1103,2207,3301],"run_ids":{"candidate":"93989e1c-c260-4365-875d-0bb6c184970d","no_pop_control":"e0eb9535-b854-4acb-a17d-e10600d242c0","retained_only_poison":"3f64dcd0-690c-4915-8260-18d6ad131225"},"verdict":"discard_current_authority_layout","primary_metric":{"name":"okv.eval.authority.snapshot_growth_ratio","statistic":"maximum","ceiling":2,"candidate":9.172395356214823,"no_pop_control":12.005492127671584,"retained_only_poison":1},"measurements":{"commits":[256,1024,4096],"live_keys":256,"value_bytes":128,"projected_snapshot_bytes":[280547,734753,2573288],"actual_snapshot_bytes":[478321,1526216,5742479],"final_transaction_authority_bytes":992491,"final_durable_outcomes_bytes":1055339,"final_request_fingerprints_bytes":524430,"final_retained_txlog_bytes_before_projection":3169201},"hard_gates":{"three_real_openraft_data_processes":"passed","ideal_projection_non_mutating":"passed","fresh_controller_replay_exact":"passed","projected_snapshot_growth_at_most_2x":"failed","retained_only_accounting_poison_detected":"passed"},"budget":{"kind":"seconds","limit":480,"candidate_observed":548.58700025,"control_observed":544.307813375,"poison_observed":544.507701709},"receipts":"docs/artifacts/eval-receipts/authority-state-g4.5-v1/","telemetry":{"otlp_http":false,"reason":"dirty local diagnostic"},"learned":"Object-frontier safe pop can reclaim only recovery commands. The current authority also retains lifetime-growing OCC history, durable retry outcomes, request fingerprints, and user values. Split those state domains by minimum read version, retry floor, serving coverage, and object-durable frontier before implementing safe pop."}
{"schema_version":1,"recorded_at":"2026-08-26T11:18:25Z","kind":"diagnostic_strategy_falsifier","lane":"transaction-authority-split-frontiers","hypothesis":"At fixed live key cardinality, independently advancing the minimum admitted read version R and per-client retry floor Q while projecting ideal object frontier O=C keeps complete transaction-authority state within 2x growth from 256 to 4096 lifetime commits.","candidate_commit":"a56442ad800deedd72a404a0886e88831eb308a0+dirty","suite":"transaction-authority-split-frontiers-v1","suite_hash":"483b0bb149a728829b1edfd1b23e1f80bf3e3e7abc0c39c3e6141fbd074dd4aa","profile":"local-process","profile_hash":"d2f3008217623bf0c5ac02189b7f587bf01bb77a4ddbf3d9cc1faf3fc7c0188c","backend":"data-openraft-local-process","build":"debug","seeds":[1103,2207,3301],"run_ids":{"candidate":"ed9c894b-531f-40aa-9f5c-cd1ee5f2331d","object_only_control":"3e68f55e-eab7-47be-948a-6b88a27ee248","serving_only_poison":"b8e1a531-834b-4887-aedb-a3ad03318841"},"verdict":"inconclusive","decision":"keep_split_state_discard_current_speed","primary_metric":{"name":"okv.eval.authority.snapshot_growth_ratio","statistic":"maximum","ceiling":2,"candidate":1.002892827624208,"object_only_control":9.169366936159145,"serving_only_poison":1.0028077251221592},"measurements":{"commits":[256,1024,4096],"live_keys":256,"value_bytes":128,"candidate_projected_snapshot_bytes":[130671,130807,131047],"candidate_actual_snapshot_bytes":[328445,923808,3310992],"candidate_final_transaction_state_bytes":129372,"candidate_final_retained_txlog_bytes_before_projection":3179955,"object_only_final_projected_snapshot_bytes":2573392},"hard_gates":{"three_real_openraft_data_processes":"passed","expired_retry_fails_closed":"passed","ideal_projection_non_mutating":"passed","fresh_controller_replay_exact":"passed","projected_snapshot_growth_at_most_2x":"passed","object_only_control_exceeds_2x":"passed","serving_only_accounting_poison_detected":"passed","budget_must_hold":"failed"},"budget":{"kind":"seconds","limit":180,"candidate_observed":545.726423916,"control_observed":540.066010083,"poison_observed":545.694998584},"receipts":"docs/artifacts/eval-receipts/authority-state-g4.6-v1/","telemetry":{"otlp_http":false,"reason":"dirty local diagnostic"},"learned":"The split-frontier state shape removes lifetime-commit growth without hiding omitted state. It does not improve the sequential sync-per-entry process path, which delivered only about 30 measured commits per second including cluster setup and failed the fixed execution budget. Authenticate O and add crash-safe pop, then test commit batching under an independent performance suite."}
