{"schema_version":1,"recorded_at":"2026-08-27T20:15:00Z","kind":"clean_real_infra_native_concurrent_read_admission","lane":"hot-ssd-native-concurrency","hypothesis":"At 8 and 32 concurrent clients, the native version-bound snapshot preserves at least 80 percent of topology-matched direct RocksDB throughput and keeps p99 within 20 percent in both process orders.","candidate_commit":"e478806314049145db70207761d331b0be5c1ff1","source_bundle_sha256":"f5c91cad4f9089235891857c423841694be63dadcff26cf84d0839b2f66c6124","suite":"single-range-native-concurrency-admission-v1","suite_hash":"f1f7aa6a503ef2132567bc61cc41ec47a045c9f9f04f4ca09e65941ee922f341","profile":"gcp-r0-nvme","profile_hash":"1637f651b64f893b660c636b51dd2b811c8e6a843abd93dd7a9da250d7f4ed70","backend":"object-store-gcs+authority-openraft-local-process+data-openraft-local-process+rocksdb-native-resident-nvme","build":"release-linux-x86_64","binary_sha256":"4f2cb74f25c9e18df3bb6b84579d4f1d6f931ef130d2f2507489d835478d4c01","machine":{"runner":"n2-standard-8","cpu_platform":"Intel Cascade Lake","hot_scratch":"375 GiB GCP local SSD, NVMe, ext4","stable_media":"200 GiB pd-ssd","object_store":"regional versioned GCS","receipt_sha256":"40e1aed8101986214f490ac5bfb5a5c666a2844746338ce86cbf092ff18d7a3f"},"seeds":[1103,2207,3301],"repeats":5,"run_ids":{"clients_8_candidate_ab":"50757893-0d8c-423b-b85d-7196a0f9a8f5","clients_8_control_ab":"dfbb30dc-b536-42f0-8965-46bc54d22f6f","clients_8_control_ba":"ad831525-a41b-4979-a63b-64f71d2174bc","clients_8_candidate_ba":"ee423fef-41bd-40ae-9341-dc450000f3db","clients_32_candidate_ab":"2cd76151-d3f0-4b79-84f1-56b3bd5f6988","clients_32_control_ab":"38b0f011-26f1-4beb-8f8e-a11d6a739c4d","clients_32_control_ba":"7b15a799-860b-470b-a0b1-8570f1fd6fcf","clients_32_candidate_ba":"1476586e-a8cb-43fb-acd7-836f2ba0b56f"},"verdict":"keep","decision":"admit_gp3_1_1_native_concurrent_resident_reads_advance_cache_pressure_and_replicated_commit","primary_metric":{"name":"okv.eval.operation.throughput_ratio","statistic":"minimum","value":0.873379020436128},"measurements":{"clients_8":{"ab":{"throughput_ratio":0.8797779813692662,"p99_ratio":1.18422649140546},"ba":{"throughput_ratio":0.873379020436128,"p99_ratio":1.122004357298475}},"clients_32":{"ab":{"throughput_ratio":0.8802793739892719,"p99_ratio":1.1072488342518017},"ba":{"throughput_ratio":0.8906117920244879,"p99_ratio":1.1478223557176572}},"samples_total":120,"measured_reads_total":24000000,"native_local_bytes_max":12564950,"post_activation_object_operations":0,"correctness_anomalies":0},"hard_gates":{"workload_gate_evaluations_passed":128,"workload_gate_evaluations_failed":0,"comparison_constraints_passed":8,"comparison_constraints_failed":0,"all_run_ids_in_otel_logs_metrics_traces":true},"receipts":"docs/artifacts/eval-receipts/single-range-native-concurrency-gcp-r0-2026-08-27/","durable_receipts":"gs://doss-objectkv-dev-okv-evals/runs/gp311-r0-20260827/","telemetry":{"otlp_http":true,"collector":"otel/opentelemetry-collector-contrib:0.157.0","all_run_ids_in_all_signals":true},"operations":{"lease_teardown":"9 resources destroyed, 0 Terraform state entries remain","live_scratch_objects_deleted":384,"live_scratch_bytes_deleted":550912512},"learned":"The topology-matched native version-bound read boundary stays inside the frozen direct RocksDB envelope through 32 clients on one eight-vCPU GCP machine. The closest bound is 8-client AB p99 at 1.1842x. This admits resident concurrency only; explicit cache pressure, CPU per read, physical read amplification, replicated commit, and complete-cell behavior remain open."}
{"schema_version":1,"recorded_at":"2026-08-28T09:20:00Z","kind":"clean_real_infra_native_cache_pressure_calibration","lane":"native-resident-cache-pressure","hypothesis":"With a 64 MiB exact-value fixture, 32 MiB explicit RocksDB block cache, Zipf 1.4 trace, and eight clients, the native version-bound snapshot preserves at least 80 percent of topology-matched direct RocksDB throughput and keeps p99 within 20 percent in both process orders while reporting measured-window cache and process attribution.","candidate_commit":"76d2cae98d846901c1833a3c038be983509c7f6a","parent_commit":"34d0c50d7ff57b2d8d798fc5407a29dc2bb88214","source_bundle_sha256":"d48515347fec846c0c5f9b115097ceee26232e642a7b784b8e96038ce8f43de3","suite":"native-resident-cache-pressure-calibration-v1","suite_hash":"9ac7b9e7d0307d3415dc03d10dd721dbdfb412b12d9bf69b03a515c38899e2ec","profile":"gcp-r0-calibration-2x-zipf14","profile_hash":"ab928cb84dec50e39ff9ba72ec83bba33af28e0bafbd015de0382a0cead435e9","workload_profile_hash":"46981dfa3c1e39cb109616c4c38a27aa473d9f4d3ca5c8ca9991d67d0d858774","backend":"object-store-gcs+authority-openraft-local-process+data-openraft-local-process+rocksdb-native-resident-nvme","build":"release-linux-x86_64","binary_sha256":"c4441e0531faa19ac73743ad38b01335e9171f451e460497b6fd2457ec81afd4","machine":{"runner":"n2-standard-8","cpu_platform":"Intel Cascade Lake","hot_scratch":"375 GiB GCP local SSD, NVMe, ext4","stable_media":"200 GiB pd-ssd","object_store":"regional versioned GCS","receipt_sha256":"7051803674b307097d6b5d2cb9673222c2a003c8d80880876245a0ef2b361cbc"},"seeds":[1103],"repeats":15,"run_ids":{"ab_native":"9650c11d-5ece-4a04-acfd-5531c9738edf","ab_control":"f6bcb301-4367-4aad-a0ad-cee0515d3eee","ba_control":"9f427869-bb74-43c8-aa6c-aa61faabf6c7","ba_native":"877e3ee0-1938-49e7-858b-b5e32408d50c","aborted_pre_receipt":"27069e4c-930d-491f-b07a-90739ad4dfe1"},"verdict":"worse","decision":"hold_t27_profile_native_point_read_cpu_persist_one_fixture_make_remaining_constraints_executable_then_rerun_unchanged_calibration","primary_metric":{"name":"okv.eval.operation.throughput_ratio","statistic":"minimum","value":0.5659265406068754,"ab":{"candidate":1012793.7340088352,"control":1696914.4869826948,"ratio":0.5968442969743847},"ba":{"candidate":1011244.6644860699,"control":1786883.2647460825,"ratio":0.5659265406068754}},"measurements":{"dataset_logical_bytes":67108864,"block_cache_bytes":33554432,"zipf_alpha":1.4,"clients":8,"samples_per_subject_order":15,"measured_reads_total":60000000,"ab":{"candidate_p99_ns":22533,"control_p99_ns":16927,"p99_ratio":1.3311868612276245,"candidate_cpu_ns_per_read":7477.379,"control_cpu_ns_per_read":4481.611,"cpu_ratio":1.6684578380408295,"candidate_cache_hit_ratio":0.9972595,"control_cache_hit_ratio":0.994449},"ba":{"candidate_p99_ns":24445,"control_p99_ns":15703,"p99_ratio":1.5567089091256447,"candidate_cpu_ns_per_read":7492.215,"control_cpu_ns_per_read":4291.108,"cpu_ratio":1.7459861182706191,"candidate_cache_hit_ratio":0.9972625,"control_cache_hit_ratio":0.994503},"physical_read_bytes_per_read":0,"peak_rss_bytes_max":399355904},"hard_gates":{"workload_gate_evaluations_passed":84,"workload_gate_evaluations_failed":0,"throughput_constraints_passed":0,"throughput_constraints_failed":2,"p99_constraints_passed":0,"p99_constraints_failed":2,"cpu_bound_diagnostic_passed":0,"cpu_bound_diagnostic_failed":2,"cpu_constraint_executable":false,"physical_byte_constraint_executable":false,"all_run_ids_in_otel_logs_metrics_traces":true},"receipts":"docs/artifacts/eval-receipts/native-resident-cache-pressure-gcp-r0-2026-08-28/","durable_receipts":"gs://doss-objectkv-dev-okv-evals/runs/gp312-r0-20260828/objectkv-gp312-r0-evidence/","telemetry":{"otlp_http":true,"collector":"otel/opentelemetry-collector-contrib:0.157.0","all_run_ids_in_all_signals":true,"records_per_run":{"logs":2,"metrics":1,"traces":1}},"operations":{"discarded_initial_run":"three-seed setup could not finish within the bounded command budget","fixture_setup_seconds_per_receipt":"about 2100 to 2400","replicated_fixture_scratch_bytes":"about 1.2 GiB per 64 MiB logical fixture","live_scratch_objects_deleted":152,"live_scratch_bytes_deleted":550853784,"lease_teardown":"9 resources destroyed, 0 Terraform state entries remain","durable_evidence_objects":19,"durable_evidence_bytes":4758698},"learned":"The current native point-read composition fails the 64 MiB calibration independent of process order. Cache hit ratio, RSS, and zero physical read bytes do not explain the gap, while CPU per read is 1.67x to 1.75x control. Profile the native snapshot, head, history, metadata, and owned-value path before changing storage media or expanding the fixture. Persist one fixture across all subjects because current replicated setup is about 19x logical bytes and dominates experiment duration."}
{"schema_version":1,"recorded_at":"2026-08-28T20:06:00Z","kind":"clean_real_infra_native_cache_pressure_optimization","lane":"native-resident-cache-pressure","hypothesis":"The forced flush after a small disposable tail advance creates a second SST probe on untouched latest reads and explains most of the native CPU and throughput gap under the frozen 64 MiB cache-pressure calibration.","candidate_commit":"a4cf9a8a8d86a1dfa84d5af01eb514149dce1ed8","parent_commit":"0d494849a1340ab441b880adfc75ced73421287b","source_bundle_sha256":"235e7e6b78065f37de7d2ac7682a1afe3842b01ae0c557734a3e868ec2447065","suite":"native-resident-cache-pressure-rerun-v2","suite_hash":"b47cb8b8470c1914f184ad6abaced2c0d65b3e6b9fd884349735f0417ef24193","profile":"gcp-r0-calibration-2x-zipf14","profile_hash":"ab928cb84dec50e39ff9ba72ec83bba33af28e0bafbd015de0382a0cead435e9","workload_profile_hash":"46981dfa3c1e39cb109616c4c38a27aa473d9f4d3ca5c8ca9991d67d0d858774","backend":"object-store-gcs+authority-openraft-local-process+data-openraft-local-process+rocksdb-native-resident-nvme","build":"release-linux-x86_64","binary_sha256":"a94f5f4a7079aae8b1645c97046ed3a2298f11d2ec050ad48c14b8f2977125b2","machine":{"runner":"n2-standard-8","cpu_platform":"Intel Cascade Lake","hot_scratch":"375 GiB GCP local SSD, NVMe, ext4","stable_media":"200 GiB pd-ssd","object_store":"regional versioned GCS","receipt_sha256":"55d354ff986485412298905c64cac8acfc112246a1cdb47a71c5af64cc77ae0a"},"seeds":[1103],"repeats":15,"run_ids":{"ab_native":"d205e52d-9b53-4f35-a0c8-f430302b1264","ab_control":"68b1b163-55bb-4cbb-a4ff-608429e11d04","ba_control":"15550240-688f-447f-92a9-95d6a56d0927","ba_native":"7757f614-41b5-4b17-a761-9673b465a9dd"},"verdict":"keep","decision":"verify_gp3_1_2_retain_t27_for_1gib_coverage_skew_and_physical_read_curve","primary_metric":{"name":"okv.eval.operation.throughput_ratio","statistic":"minimum","value":0.9431893167977057,"ab":{"candidate":1722231.5839860742,"control":1825965.9575379358,"ratio":0.9431893167977057},"ba":{"candidate":1752425.9349182725,"control":1800165.9958267077,"ratio":0.9734801895941207}},"measurements":{"dataset_logical_bytes":67108864,"block_cache_bytes":33554432,"zipf_alpha":1.4,"clients":8,"samples_per_subject_order":15,"measured_reads_total":60000000,"ab":{"candidate_p99_ns":16073,"control_p99_ns":15394,"p99_ratio":1.0441080940626217,"candidate_cpu_ns_per_read":4460.624,"control_cpu_ns_per_read":4213.817,"cpu_ratio":1.05857088715528},"ba":{"candidate_p99_ns":15733,"control_p99_ns":15814,"p99_ratio":0.9948779562413052,"candidate_cpu_ns_per_read":4404.271,"control_cpu_ns_per_read":4277.016,"cpu_ratio":1.0297532204695985},"physical_read_bytes_per_read":0},"hard_gates":{"workload_gate_evaluations_passed":84,"workload_gate_evaluations_failed":0,"comparison_constraints_passed":8,"comparison_constraints_failed":0,"all_run_ids_in_otel_logs_metrics_traces":true},"receipts":"docs/artifacts/eval-receipts/native-resident-cache-pressure-optimized-gcp-r0-2026-08-28/","durable_receipts":"gs://doss-objectkv-dev-okv-evals/runs/gp312opt-r0-20260828/","telemetry":{"otlp_http":true,"collector":"otel/opentelemetry-collector-contrib","all_run_ids_in_all_signals":true,"records_per_run":{"logs":2,"metrics":1,"traces":1}},"operations":{"lease_teardown":"9 resources destroyed, 0 Terraform state entries remain","local_terraform_cache_bytes_deleted":121634816,"durable_evidence_objects":31,"durable_evidence_bytes":4911598},"learned":"A forced disposable-tail flush created a second SST probe and explained most of the native gap. Keeping recent tail state mutable preserved txLog durability and exact recovery while bringing native within 5.7 percent throughput, 4.5 percent p99, and 5.9 percent CPU per read of direct owned-value RocksDB in the worst order. The zero physical-read result means T27 still needs explicit page-cache treatment and the full coverage and skew sweep."}
{"schema_version":1,"recorded_at":"2026-08-28T21:12:00Z","kind":"clean_real_infra_direct_read_mechanism_preflight","lane":"native-resident-direct-read-preflight","hypothesis":"A matched RocksDB direct-table-read treatment makes Linux physical device reads observable for both the native RangeEngine and topology-matched owned-value control without changing exact point-read semantics.","candidate_commit":"a56c838947a702ab6f1a66b719e7c8fd53bc4efe","source_bundle_sha256":"d6be2259eb1cdfff4110539ef2102b21319b6e1ab8a22576c2fe0de3971689e6","suite":"native-resident-direct-read-preflight-v1","suite_hash":"24d46a5965594d8e1a4196ba8b0a39f005167e8e2a396cd4735848ebefa3600b","profile":"linux-direct-io-preflight","profile_hash":"2aa614932a169d1f891a968681e843536f513773fdc93f3fc9db44123d81a2d8","backend":"object-store-local-fs+authority-openraft-local-process+data-openraft-local-process+rocksdb-native-resident-local-nvme-direct-reads","build":"release-linux-x86_64","binary_sha256":"e9749570bea3742ca95e70d9992baef3e4a1270c03ecd8678036efae5f0082e1","machine":{"runner":"n2-standard-8","cpu_platform":"Intel Cascade Lake","hot_scratch":"375 GiB GCP local SSD, NVMe, ext4","stable_media":"200 GiB pd-ssd","receipt_sha256":"89f074e36dc925d88315c2f996169601b266a590726b350c6ef2e1c819f46e06"},"seeds":[1103],"repeats":1,"run_ids":{"native":"df97815c-0a68-4dd2-90d6-6894296ffbdd","control":"e9f8e82b-5cd1-4c1f-8a4d-2f6c6c318727","discarded_false_reuse_diagnostic":"6ccd87f7-4b9c-4ed5-86e0-f646f53160a1"},"verdict":"keep","decision":"verify_direct_read_measurement_mechanism_keep_t27_evaluating_freeze_shared_1gib_fixture_next","primary_metric":{"name":"okv.eval.operation.throughput_ratio","statistic":"single_sample","value":1.044806008565331,"candidate":122702.07119427428,"control":117440.0512519658},"measurements":{"dataset_logical_bytes":16777216,"block_cache_bytes":4194304,"zipf_alpha":0.8,"clients":8,"measured_reads_per_subject":100000,"direct_reads":true,"candidate":{"p99_ns":217130,"p999_ns":269926,"cpu_ns_per_read":10928.38,"physical_read_bytes_per_read":2960.75264},"control":{"p99_ns":224993,"p999_ns":278660,"cpu_ns_per_read":10571.81,"physical_read_bytes_per_read":2965.99552},"ratios":{"p99":0.9650522460698777,"cpu_per_read":1.0337283776382662,"physical_read_bytes_per_read":0.9982323371816827}},"hard_gates":{"workload_gate_evaluations_passed":44,"workload_gate_evaluations_failed":0,"direct_read_mode_match_passed":2,"correctness_anomalies":0,"measured_object_operations":0,"linux_unit_tests_passed":2},"receipts":"docs/artifacts/eval-receipts/native-resident-direct-read-preflight-gcp-r0-2026-08-28/","durable_receipts":"gs://doss-objectkv-dev-okv-evals/runs/gp312dio-r0-20260828/","telemetry":{"otlp_http":false,"reason":"bounded smoke preflight verifies device attribution but cannot admit a performance curve"},"operations":{"lease_teardown":"9 resources destroyed, 0 Terraform state entries remain","local_terraform_cache_bytes_deleted":121634816,"durable_evidence_objects":8,"durable_evidence_bytes":2681699},"learned":"Matched direct table reads expose about 2.96 KiB of Linux physical device reads per logical point read for both subjects, replacing the buffered lane's zero-byte page-cache result. Native and control physical cost matched within 0.2 percent in this sample. One seed and one repeat verify the mechanism only; fixture reuse, AB/BA ordering, OTel, and the 1 GiB coverage and skew sweep remain required for T27 admission."}
{"schema_version":1,"recorded_at":"2026-08-29T02:58:56Z","kind":"clean_real_infra_persisted_gcs_fixture_preflight","lane":"object-fixture-gcs-preflight","hypothesis":"One content-addressed 64 MiB object fixture can be persisted once to regional GCS and reopened by fresh native and direct-control ABBA workers while keeping base values out of txLog, transaction-authority scratch below 0.25x, setup below 300 seconds, and hot object requests at zero.","candidate_commit":"6f812ddf3d261d30cc9698b6baed3f97876ace45","parent_commit":"e4fcbe89fa9519a020ffe1df8a4b3d39b63d0c8e","suite":"object-fixture-gcs-preflight-v1","suite_hash":"1c15f35b9089a21b491ca83e73680cef15f4e1285b954a23af6ba2358f0213ac","profile":"gcp-r0-64m","profile_hash":"0a9eaab7bfa034589be1cc98a1f7a037cdf296b270c81cb86ef83d74c004dbd2","backend":"object-store-gcs+data-openraft-local-process+rocksdb-resident+persisted-fixture","build":"release-linux-x86_64","binary_sha256":"2543c70b2e558c691bb67fb90df94e3901d1ccf056f1e5be18d8482265217281","machine":{"runner":"c3-highcpu-22","cpu_platform":"Intel Sapphire Rapids","scratch":"100 GiB pd-balanced boot disk","object_store":"regional versioned GCS","receipt_sha256":"aaa96fc8f710c11f5a0f947afa619fc7ba8438c604d08b8dc0cbbb8df6e28f2f","public_ip":null},"seeds":[4244],"repeats":1,"run_ids":{"candidate":"ffe07640-13e7-4631-bd8d-9ff64aef133d","reuse_bypass_poison":"84674b28-5292-4c39-a854-da629fbce642"},"verdict":"keep","decision":"verify_rfc0044_phase4_freeze_1gib_t27_persisted_fixture_curve_next","primary_metric":{"name":"okv.eval.object_fixture.setup_seconds","statistic":"maximum","value":11.696263524,"median":4.84530764,"samples":[7.419748018,1.451379704,11.696263524,2.270867262]},"measurements":{"logical_bytes":67108864,"gcs_object_count":20,"gcs_object_bytes":68857626,"workload_seconds":55.906525983,"exact_descriptor_reopens":3,"transaction_authority_physical_bytes_max":108918,"transaction_authority_scratch_ratio_max":0.001623004674911499,"fixture_response_bytes_total":413165382,"hot_object_requests":0,"poison_exact_reopens":2},"hard_gates":{"candidate_passed":19,"candidate_failed":0,"reuse_bypass_poison_detected":true,"one_fixture_identity":true,"one_tail_identity":true,"fresh_subject_processes":true,"one_empty_anchor_per_authority":true,"zero_base_values_in_txlog":true,"complete_closure_at_anchor":true,"resident_logical_images_equal":true,"all_run_ids_in_otel_logs_metrics_traces":true},"receipts":"docs/artifacts/eval-receipts/object-fixture-gcs-preflight-gcp-r0-2026-08-28/","durable_receipts":"gs://doss-objectkv-dev-okv-evals/runs/rfc0044-gcs-preflight-r0-20260828/receipts/","durable_fixture":"gs://doss-objectkv-dev-okv-evals/runs/rfc0044-gcs-preflight-r0-20260828/candidate-6f812dd/","telemetry":{"otlp_http":true,"collector":"otelcol-contrib 0.157.0","co_located":true,"all_run_ids_in_all_signals":true},"operations":{"lease_teardown":"VM, boot disk, firewall, and temporary SSH key absent","local_temporary_bundle_bytes_deleted":2831154,"local_evidence_bytes":213513},"learned":"Persisted fixture construction no longer dominates the transaction plane. The exact object closure can seed fresh subject-local RocksDB images while txLog retains only one empty anchor plus the seven-record suffix. This is setup and resource-bound evidence only. The 1 GiB coverage and skew curve remains required for T27 performance admission."}
{"schema_version":1,"recorded_at":"2026-08-30T03:25:22Z","kind":"clean_real_infra_t27_stratum_rejection","lane":"native-resident-cache-pressure","hypothesis":"At 50 percent cache coverage, Zipf 1.4, seed 3301, eight readers, and direct NVMe, provider-v1 native p99 remains within 1.20x topology-matched direct RocksDB in both process orders.","candidate_commit":"95dedb0249a69567e7c390f4c191d079f07b6d90","suite":"t27-1gib-direct-nvme-v1","plan_semantic_sha256":"40d4559af1b51db13f3dad85a089c81af84d645794eb1bd19d8079bb89b115be","workload_sha256":"7019d0e12bff05e721c867dfe3277dc87a44902d26636a5eaf08f2f54f03fb26","execution_sha256":"2f3864365f25aadd42012757a52f677713a2ca0a88571f23b98ed28a104944f7","profile":"gcp-r0-1gib-c50-z14-s3301-direct-nvme","backend":"object-store-gcs+rocksdb-native-resident-v1-vs-direct-rocksdb","build":"release-linux-x86_64","binary_sha256":"aac675c7b54974014985fe00095fea5fb31657a12f3082a61babc22c93a12b74","run_id":"912fb7e5-35db-4f63-99db-cdd8201f23a9","seeds":[3301],"repeats":5,"verdict":"worse","decision":"retain_rejection_stop_provider_v1_implement_rfc0047_replay_exact_stratum","primary_metric":{"name":"p99_latency_ratio","limit":1.2,"ab":1.3076135041,"ba":1.3398974511},"measurements":{"throughput_ratio":{"ab":0.9957602327,"ba":0.956539218},"cpu_per_read_ratio":{"ab":1.0178731063,"ba":1.0350779011},"physical_bytes_per_read_ratio":{"ab":1.0064957777,"ba":1.0065467266},"read_amplification_ratio":{"ab":1.0,"ba":1.0},"native_local_bytes":2215101820,"control_local_bytes":1099175660,"local_bytes_ratio":2.015239,"fresh_positions":20,"measured_reads":20000000},"hard_gates":{"p99_passed":false,"throughput_passed":true,"cpu_passed":true,"physical_bytes_passed":true,"read_amplification_passed":true,"correctness_passed":true,"pressure_passed":true,"fresh_process_passed":true,"otel_complete":true},"receipts":"docs/artifacts/eval-receipts/t27-1gib-stratum-c50-z14-s3301-failed-gcp-r0-2026-08-30/","durable_receipts":"gs://doss-objectkv-dev-okv-evals/runs/rfc0044-t27-admission-r0-20260829/strata/c50-z14-s3301/","learned":"The native format duplicated the complete object base into head and history, produced 2.015239x control local bytes, and shifted the p99 cache-miss knee enough to reject the frozen limit in both orders. Provider v2 must use sparse post-frontier history and pass this exact replay before T27 restarts."}
