{"schema_version":1,"recorded_at":"2026-08-26T11:44:00Z","kind":"diagnostic_recovery_frontier","lane":"authenticated-object-frontier","hypothesis":"A pending immutable object closure plus a data-voter quorum certificate can make physical recovery-stream pop crash-safe without placing object I/O on the foreground commit path.","candidate_commit":"a56442ad800deedd72a404a0886e88831eb308a0+dirty","suite":"authenticated-object-frontier-v1","suite_hash":"40b1d296f09c7694067b670d266e995765567ecc6217c7fde22ecde2d60cb8ad","profile":"local-fs","profile_hash":"41181a5141de097f73ad7ec9b974e08947599fc49018fd4b00f035806830d9f2","backend":"object-store-local-fs+authority-openraft+data-openraft","build":"debug","seeds":[4701,4702,4703],"run_ids":{"candidate":"f314d6e1-386f-4c1d-b46d-9c283a63a144","missing_pending_control":"e3467af2-a4a9-4165-831b-3399f3150cde","forged_coverage_control":"7bbf3d7e-f53c-4105-bfbf-14157b162f58","subquorum_control":"5bfbd653-0a68-4b95-9ad6-564b19222a3e"},"verdict":"inconclusive","decision":"keep_authenticated_object_frontier_advance_to_commit_throughput","primary_metric":{"name":"okv.eval.object_frontier.protocol_duration","statistic":"p99","candidate_seconds":0.16033075,"samples_seconds":[0.144161375,0.16033075,0.146913875]},"measurements":{"transactions":16,"value_bytes":128,"closure_bytes_median":3299,"physical_pop_seconds_median":0.02051875,"protocol_seconds_median":0.146913875,"retention_floor":18,"popped_records":16,"remaining_records":0,"certificate_signers":3},"hard_gates":{"candidate":"all_passed","missing_pending_control":"all_passed","forged_coverage_control":"all_passed","subquorum_control":"all_passed","exact_object_recovery_after_pop":true,"data_and_publication_leader_failover":true,"killed_data_voter_restart":true,"budget_must_hold":true},"budget":{"kind":"seconds","limit":90,"candidate_observed":31.385656375},"receipts":"docs/artifacts/eval-receipts/object-frontier-g4.7-v1/","telemetry":{"otlp_http":false,"reason":"dirty local diagnostic"},"learned":"The application retained recovery stream can be physically bounded without object access on transaction acknowledgement. Pending publication state protects the closure across pop and activation crashes. This does not purge the internal OpenRaft journal or admit commit throughput, independent-machine durability, cloud object behavior, or production signer operations."}
{"schema_version":1,"recorded_at":"2026-08-26T12:08:12Z","kind":"diagnostic_strategy_falsifier","lane":"commit-group","hypothesis":"Submitting independent transaction requests through a bounded concurrency window lets OpenRaft and the stable journal group durable appends enough to reach at least 200 transactions per second, at most 250 ms p99, and at least 4x the same-durability sequential control without changing strict-serializable recovery semantics.","candidate_commit":"a56442ad800deedd72a404a0886e88831eb308a0+dirty","suite":"commit-group-v1","suite_hash":"855f49c190c8710454ef993ed709437b30082596ea99a243e652569cf9e91e77","profile":"local-process","profile_hash":"af3168c0ca543087ab0d3a2e45646b2987a96c2e021abb80f97ae46fcbd9884a","backend":"data-openraft-local-process+stable-journal","build":"release","seeds":[4801,4802,4803],"run_ids":{"candidate":"a27fd93c-fccb-46da-beaf-1437bbf89418","sequential_control":"8e964ea9-df15-40cc-95a2-a381697a2fd3","early_ack_poison":"69fa1b90-26d0-47c8-9673-adaaccf0663a"},"verdict":"discard","decision":"discard_bounded_concurrency_as_final_group_commit_advance_to_explicit_batch_entry","primary_metric":{"name":"okv.eval.commit.throughput","statistic":"median","candidate_transactions_per_second":153.70792986565343,"sequential_control_transactions_per_second":38.77219954536567,"paired_ratio":3.9643850921020465},"measurements":{"transactions_per_seed":512,"live_keys":256,"value_bytes":128,"candidate_max_in_flight":32,"control_max_in_flight":1,"candidate_max_p99_seconds":0.264887417,"control_max_p99_seconds":0.034051209,"candidate_median_entries_per_append":12.19047619047619,"control_median_entries_per_append":1,"early_ack_apparent_transactions_per_second":3400.389004502115},"hard_gates":{"three_real_openraft_data_processes":"passed","release_build":"passed","strict_serializable_recovery_contract":"passed","fresh_controller_semantic_replay":"passed","candidate_min_200_transactions_per_second":"failed","candidate_max_250ms_p99":"failed","paired_min_4x":"failed","median_voter_min_4_entries_per_append":"passed","early_ack_poison_detected":"passed"},"budget":{"kind":"seconds","limit":120,"candidate_observed":16.079746708,"control_observed":55.62297125,"poison_observed":1.99129225},"receipts":"docs/artifacts/eval-receipts/commit-group-g4.8-v1/","telemetry":{"otlp_http":false,"reason":"dirty local diagnostic"},"learned":"Bounded concurrency yields useful pipelining and follower append coalescing, but the leader still synchronizes one stable append per transaction. The mechanism is not sufficient as objectKV group commit. Preserve the I/O instrumentation and recovery checks, then test an explicit commit-proxy batch entry under the same durability control."}
{"schema_version":1,"recorded_at":"2026-08-26T12:28:35Z","kind":"diagnostic_mechanism_admission","lane":"transaction-batch","hypothesis":"One explicit Raft application entry containing 16 independently retryable transactions can reach at least 400 durable transactions per second, at most 100 ms p99, at least eight logical transactions per leader append, and at least 2.5x the same-durability one-entry control while preserving ordered versionstamps, conflict semantics, pagination, exact retry, failover, and restart.","candidate_commit":"a56442ad800deedd72a404a0886e88831eb308a0+dirty","suite":"transaction-batch-v1","suite_hash":"c34b47eb5965dedf95d529c9b72a6fe8af4c73adc58bdec45060b6816862f585","profile":"local-process","profile_hash":"8dbf4d754f07ee26f3182015ca4fd8965803d00e25ebb1e479c5af24ec00afc5","backend":"data-openraft-local-process+stable-journal","build":"release","seeds":[4901,4902,4903],"run_ids":{"candidate":"0f50aeae-d153-43ef-b347-112411a70ad7","one_entry_control":"0a891a4a-6053-44b9-b53d-5fa49a8cf238","duplicate_identity_control":"e12401cb-c2e4-4551-bf2c-b21ebb250224","early_ack_poison":"13ab1d24-fce2-4d61-8727-2b42c48d8dc0"},"verdict":"inconclusive","decision":"keep_transaction_batch_advance_to_sustained_stress_and_independent_media","primary_metric":{"name":"okv.eval.commit.throughput","statistic":"median","candidate_transactions_per_second":559.5110943974171,"one_entry_control_transactions_per_second":151.9435155916082,"paired_ratio":3.682362437116447},"measurements":{"transactions_per_seed":512,"live_keys":256,"value_bytes":128,"transactions_per_batch":16,"candidate_batch_count":32,"candidate_max_p99_seconds":0.034015666,"control_max_p99_seconds":0.262174416,"leader_logical_transactions_per_append":16,"early_ack_apparent_transactions_per_second":13179.571663920922},"hard_gates":{"three_real_openraft_data_processes":"passed","release_build":"passed","ordered_versionstamps":"passed","shared_batch_commit_version":"passed","paginated_recovery":"passed","exact_individual_and_batch_retry":"passed","in_batch_conflict_detected":"passed","leader_failover_and_restart":"passed","candidate_min_400_transactions_per_second":"passed","candidate_max_100ms_p99":"passed","paired_min_2_5x":"passed","leader_min_8_logical_transactions_per_append":"passed","duplicate_identity_control":"passed","early_ack_poison_detected":"passed","fresh_controller_replay":"passed","budget_must_hold":"passed"},"budget":{"kind":"seconds","limit":120,"candidate_observed":10.811396542,"control_observed":15.918153375,"duplicate_control_observed":0.664893042,"poison_observed":1.986261},"receipts":"docs/artifacts/eval-receipts/transaction-batch-g4.9-v1/","telemetry":{"otlp_http":false,"reason":"dirty local diagnostic"},"learned":"The leader synchronization bottleneck can be amortized without collapsing transactions into one application atomic unit. A FoundationDB-style shared commit version plus batch order preserves per-transaction identity and ordered recovery while reducing the measured leader append count from 512 to 32. The mechanism now needs delay, byte, overload, conflict, fairness, objectification-convergence, clean-source, and independent-media gates."}
{"schema_version":1,"recorded_at":"2026-08-26T13:07:51Z","kind":"diagnostic_policy_falsifier","lane":"commit-proxy","hypothesis":"A bounded commit proxy with 16 items, 64 callers, a 2 ms delay, and a 256 KiB entry cap can start from independent client requests and reach at least 500 durable transactions per second, at most 100 ms p99, at least eight logical transactions per leader append, and at least 2.5x the same-durability one-entry control while preserving exact retry, replay, failover, restart, byte, sparse, and overload semantics.","candidate_commit":"a56442ad800deedd72a404a0886e88831eb308a0+dirty","suite":"commit-proxy-v1","suite_hash":"89381b04a5df70ff631138a98fb777d89a0895cad7e92a911d97e0ff93aeb1ba","profile":"local-process","profile_hash":"e1d312426f350a86118cc04d7c2ac335e8f0a9d15a6784c9db4bcea17653a9d3","backend":"data-openraft-local-process+stable-journal","build":"release","seeds":[5001,5002,5003],"run_ids":{"candidate":"1002a622-a873-4a54-b3e9-3cb3ac0ae0d1","admission_knee_control":"89447838-34e6-421e-8cf5-b730ff37f97d","sparse_control":"fcd5c544-4698-42c0-af66-03b83d99775c","byte_control":"4c17e0e7-e4f5-4b5d-9719-7285acd9c841","overload_control":"06292077-0772-48bd-b795-b3cdc2dd7249","oversized_poison":"14e546e2-fd8e-4c13-9688-bd86329bba51","one_entry_control":"4e0d14bc-8a25-4b5b-839b-690595eb41ab"},"verdict":"discard","decision":"discard_16_item_64_caller_configuration_on_latency_advance_to_separately_frozen_32_item_candidate","primary_metric":{"name":"okv.eval.commit.throughput","statistic":"median","median":581.7907037771298,"candidate_transactions_per_second":581.7907037771298,"one_entry_control_transactions_per_second":191.72355261121766,"paired_ratio":3.034529},"measurements":{"transactions_per_seed":1024,"candidate_concurrent_clients":64,"max_batch_items":16,"candidate_max_p99_seconds":0.131488458,"admission_knee_max_p99_seconds":0.063398334,"candidate_logical_transactions_per_append":16,"sparse_batch_items":1,"sparse_max_p99_seconds":0.028532167,"byte_control_batch_items":8,"byte_control_max_entry_bytes":119731,"overload_attempted":512,"overload_admitted":16,"overload_rejected":496},"hard_gates":{"independent_request_outcomes":"passed","exact_retry_replay_failover_and_restart":"passed","entry_byte_bound":"passed","sparse_delay_closure":"passed","explicit_overload_backpressure":"passed","oversized_item_rejected_before_mutation":"passed","candidate_min_500_transactions_per_second":"passed","candidate_max_100ms_p99":"failed","paired_min_2_5x":"passed","leader_min_8_logical_transactions_per_append":"passed","budget_must_hold":"passed"},"budget":{"kind":"seconds","limit":180,"candidate_observed":11.177417333,"control_observed":24.141309208},"receipts":"docs/artifacts/eval-receipts/commit-proxy-g4.10a-v1/","telemetry":{"otlp_http":false,"reason":"dirty local diagnostic"},"learned":"Starting from independent requests preserved the transaction contract, but a 16-item batch at 64 callers formed a second queue wave and crossed the frozen p99 ceiling. The 32-caller control isolated the local admission knee. Discard this exact configuration rather than weaken the latency gate."}
{"schema_version":1,"recorded_at":"2026-08-26T13:07:52Z","kind":"diagnostic_mechanism_admission","lane":"commit-proxy-batch32","hypothesis":"A separately frozen 32-item commit-proxy batch at 64 callers can reach at least 900 durable transactions per second, at most 100 ms p99, at least 16 logical transactions per leader append, and at least 4x the same-durability one-entry control while preserving independent request, byte, sparse, overload, retry, replay, failover, and restart semantics.","candidate_commit":"a56442ad800deedd72a404a0886e88831eb308a0+dirty","suite":"commit-proxy-batch32-v1","suite_hash":"c0e2981a4b06df11b140e1b595e0824514a15c9be953eea5f3aef41d5047ace6","profile":"local-process","profile_hash":"8c47183f13a08ee56e6e3bb42402d892cb4c0e934132c8b047a5798e57d2b6f6","backend":"data-openraft-local-process+stable-journal","build":"release","seeds":[5051,5052,5053],"run_ids":{"candidate":"be37cc6b-5e31-4114-916d-666954204f6f","admission_knee_control":"f4086686-57bd-4666-b183-1d539548c699","sparse_control":"27d8d13b-fae4-4c42-adda-0d20c474b1b2","byte_control":"2a4c7098-d20c-4a59-9b33-d7dceff43840","overload_control":"dcb667b9-fa56-4850-982f-64bb7c7e6c0c","oversized_poison":"c4681935-e000-41aa-a633-1963a2cb25a5","one_entry_control":"cbe29754-8b95-4b54-b02f-34a99d6a54cc"},"verdict":"inconclusive","decision":"retain_32_item_local_candidate_for_conflict_and_concurrent_object_frontier_stress","primary_metric":{"name":"okv.eval.commit.throughput","statistic":"median","median":1157.3687083621562,"candidate_transactions_per_second":1157.3687083621562,"candidate_samples":[1157.3687083621562,1169.9667586165328,1021.2361520091063],"candidate_mad":12.59805025437663,"one_entry_control_transactions_per_second":182.09251686889783,"paired_ratio":6.355937785161},"measurements":{"transactions_per_seed":1024,"candidate_concurrent_clients":64,"max_batch_items":32,"candidate_max_p99_seconds":0.076101083,"candidate_logical_transactions_per_append":32,"candidate_max_entry_bytes":20140,"sparse_batch_items":1,"sparse_max_p99_seconds":0.030961041,"byte_control_batch_items":8,"byte_control_max_entry_bytes":119731,"overload_attempted":512,"overload_admitted":32,"overload_rejected":480},"hard_gates":{"independent_request_outcomes":"passed","ordered_contiguous_versionstamps":"passed","exact_retry_replay_failover_and_restart":"passed","entry_byte_bound":"passed","sparse_delay_closure":"passed","explicit_overload_backpressure":"passed","oversized_item_rejected_before_mutation":"passed","candidate_min_900_transactions_per_second":"passed","candidate_max_100ms_p99":"passed","paired_min_4x":"passed","leader_min_16_logical_transactions_per_append":"passed","budget_must_hold":"passed"},"budget":{"kind":"seconds","limit":180,"candidate_observed":7.888574041,"control_observed":24.797936833},"receipts":"docs/artifacts/eval-receipts/commit-proxy-batch32-g4.10a.1-v1/","telemetry":{"otlp_http":false,"reason":"dirty local diagnostic"},"learned":"The bounded independent-request proxy can amortize local leader synchronization without exposing batch identity to clients. The retained 32-item shape clears the local latency and throughput gates, while the compact v2 wire keeps the 128 KiB byte control at eight 8 KiB-value transactions. It now requires conflict and concurrent object-frontier stress before clean independent-media execution."}
{"schema_version":1,"recorded_at":"2026-08-26T13:49:37Z","kind":"diagnostic_composition_admission","lane":"commit-proxy-object-frontier","hypothesis":"A 32-item independent-request commit proxy can resolve a deterministic 25 percent conflict suffix while an authenticated immutable object frontier advances through frozen O, reconstruct exact final state from ObjectState(O) plus txLog(O,C], and clear 700 outcomes per second, 150 ms p99, 16 outcomes per leader append, and 4x the same-durability one-entry control.","candidate_commit":"a56442ad800deedd72a404a0886e88831eb308a0+dirty","suite":"commit-proxy-object-frontier-v1","suite_hash":"ef9c47edba142930d43605867eb677c8dcbd89950b93cae9d4a928003927e3d4","profile":"local-process","profile_hash":"aee86bc4b3aa50237fdfa7c4fd4e9479fa24741edd26fcdd400721466fe64c65","backend":"object-store-local-fs+publication-openraft+data-openraft+stable-journal","build":"release","seeds":[5101,5102,5103],"run_ids":{"candidate":"2c89ebe1-51f7-4769-b1a1-d1e2c74376d7","no_conflict_control":"95b5d388-46ab-4bb6-a347-8713f5239dbf","high_conflict_control":"4c6c61a9-98bc-45b7-a0d6-83c3fa77a322","one_entry_control":"30471b68-1abb-4d42-8648-1294844015ca","moving_frontier_poison":"e8b5fa03-944c-4059-8960-a4dd13129518","premature_pop_poison":"af291a68-9fef-4edb-818e-9462a4c35b1e"},"verdict":"inconclusive","decision":"retain_local_native_transaction_and_object_frontier_composition_advance_to_clean_independent_media","primary_metric":{"name":"okv.eval.commit.throughput","statistic":"median","candidate_outcomes_per_second":1075.3428723660097,"candidate_samples":[1091.5504163163694,1056.4550470144575,1075.3428723660097],"one_entry_control_outcomes_per_second":37.36946318992534,"paired_ratio":28.77597858178273},"measurements":{"prefix_transactions":512,"suffix_attempts":1024,"candidate_conflict_fraction":0.25,"candidate_committed":832,"candidate_conflicted":192,"candidate_max_p99_seconds":0.104273958,"candidate_min_outcomes_per_append":31.03030303030303,"candidate_max_frontier_seconds":0.095673459,"no_conflict_outcomes_per_second":1093.3057444461883,"high_conflict_outcomes_per_second":1081.5884570581486},"hard_gates":{"three_publication_and_three_data_processes":"passed","exact_conflict_oracle":"passed","ordered_batch_versionstamps":"passed","foreground_object_requests_zero":"passed","pending_frontier_precedes_pop":"passed","floor_equals_frozen_object_version":"passed","object_plus_suffix_reconstruction":"passed","committed_and_conflicted_retry":"passed","leader_failovers_voter_restart_and_fresh_controller":"passed","observed_concurrent_suffix_progress":"passed","candidate_min_700_outcomes_per_second":"passed","candidate_max_150ms_p99":"passed","candidate_min_16_outcomes_per_append":"passed","paired_min_4x":"passed","no_conflict_min_850_outcomes_per_second":"passed","frontier_max_2_seconds":"passed","moving_frontier_poison":"passed","premature_pop_poison":"passed"},"budget":{"kind":"seconds","limit":180,"candidate_observed":7.813972208,"one_entry_control_observed":128.215076583},"receipts":"docs/artifacts/eval-receipts/commit-proxy-object-frontier-g4.10b-v1/","telemetry":{"otlp_http":false,"reason":"dirty local diagnostic"},"learned":"Concurrent authenticated objectification does not erase the local batching advantage or corrupt the retained suffix at this scale. The exact object-plus-tail equation survives controlled conflict, both authority failovers, voter restart, and fresh-client recovery. Independent failure domains, remote objects, repeated frontier convergence, physical OpenRaft journal reclamation, clean-source reproducibility, OTel, and economics remain unproven."}
{"schema_version":1,"recorded_at":"2026-08-26T14:23:15Z","kind":"diagnostic_mechanism_admission_with_state_shape_falsifier","lane":"process-snapshot-compaction","hypothesis":"A three-process OpenRaft data quorum can durably snapshot complete state, reject purge above snapshot coverage, canonical-compact physical journals, stop every process, reopen exact state plus retained suffix, replay one exact retry, and accept a new suffix commit.","candidate_commit":"a56442ad800deedd72a404a0886e88831eb308a0+dirty","suite":"process-snapshot-compaction-v1","suite_hash":"a4cf8cec81069b7e67c9be810993f849b120d717c9378508e5089400a95b0433","profile":"local-process","profile_hash":"a5820917e716e0e3d8f1dee25ffa96451328c92c2413162bf6a0be18eeee90da","backend":"data-openraft-local-process+durable-state-snapshot+canonical-journal","build":"release","seeds":[5501,5502,5503],"run_ids":{"candidate":"7eeaa179-4b49-465a-9886-34af7501b0f4","purge_before_snapshot_poison":"8fb8a75a-d3d9-4f43-82d9-eb235cabbf34"},"verdict":"inconclusive","decision":"retain_snapshot_and_compaction_mechanism_reject_unfrontiered_snapshot_shape_freeze_g4_11a_1","primary_metric":{"name":"okv.eval.storage.amplification","statistic":"maximum","candidate":38.66082000732422,"samples":[38.658119201660156,38.66082000732422,38.65033721923828]},"measurements":{"transactions_per_seed":1024,"transactions_per_batch":32,"logical_bytes":131072,"candidate_journal_bytes_before_max":6391575,"candidate_journal_bytes_after_max":879,"candidate_snapshot_bytes_max":5066472,"candidate_wall_seconds":3.825544084,"poison_journal_bytes_before_and_after_max":199725,"poison_wall_seconds":0.538050208},"hard_gates":{"three_real_openraft_data_processes":"passed","release_build":"passed","snapshot_covers_purge":"passed","physical_journal_reclamation":"passed","full_quorum_restart":"passed","retained_stream_restart":"passed","exact_retry_after_restart":"passed","suffix_commit_after_restart":"passed","purge_before_snapshot_rejected_without_mutation":"passed","budget_must_hold":"passed"},"receipts":"docs/artifacts/eval-receipts/process-snapshot-compaction-g4.11a-v1/","telemetry":{"otlp_http":false,"reason":"dirty local diagnostic"},"learned":"The crash-safe process maintenance mechanism works and the physical journal is no longer the dominant retained-media source. Without aligned resolver, retry, and authenticated object frontiers, complete replicated snapshots retain lifetime recovery and retry state and reach 38.66082x physical amplification. The next gate must compose real R, bounded Q(client), and O transitions before snapshot and repeat the cycle before any independent-media claim."}
