{"schema_version":1,"recorded_at":"2026-08-23T06:04:00Z","kind":"strategy_falsifier","lane":"slatedb-filesystem-scale","hypothesis":"Pinned SlateDB can reopen from a fresh in-process cache without reading work proportional to all durable bytes as a deterministic dataset grows from 1 MiB to 64 MiB.","parent_commit":"9f6850d52a88bee4abcece4260acd5fa7a4197e2","candidate_commit":"361a0fdcba0f0c9655dae1977f584214035d7f7d","implementation_commits":["ad2782394c2a9f9bda0d3af0a7b7c53ee98a7584","9f6850d52a88bee4abcece4260acd5fa7a4197e2","361a0fdcba0f0c9655dae1977f584214035d7f7d"],"suite":"phase0-slate-filesystem-scale-v1","suite_hash":"e04e521dfd93fa0feeb5d41399c2d1743f657690169c94386121d8094aaad62c","profile":"scale-1mib,scale-8mib,scale-64mib","backend":"slatedb-local-fs","seeds":[1103],"run_ids":["8419d658-651e-4fed-951a-bfdbd5ad52db","b7b18320-50af-4a1c-96fe-05c2b3847133","dd55baa9-5207-459a-ae2f-de48621af84f"],"verdict":"stop_incumbent_configuration","hard_gates":"all_logical_and_cache_gates_passed","measurements":[{"logical_bytes":1048576,"reopen_first_correct_read_seconds":0.004845916,"reopen_open_seconds":0.003748333,"reopen_open_requests":25,"reopen_open_read_bytes":452,"first_read_requests":19,"first_read_bytes":25423,"total_requests":263,"total_read_bytes":830024,"total_written_bytes":2212263},{"logical_bytes":8388608,"reopen_first_correct_read_seconds":0.006187292,"reopen_open_seconds":0.003732042,"reopen_open_requests":25,"reopen_open_read_bytes":452,"first_read_requests":14,"first_read_bytes":177317,"total_requests":264,"total_read_bytes":5706936,"total_written_bytes":17676009},{"logical_bytes":67108864,"reopen_first_correct_read_seconds":0.424125125,"reopen_open_seconds":0.410624792,"reopen_open_requests":131,"reopen_open_read_bytes":210773938,"first_read_requests":3,"first_read_bytes":1395893,"total_requests":345,"total_read_bytes":255477624,"total_written_bytes":141386507}],"negative_controls":{"all_discarded":true,"run_ids":["402f095c-6c4a-4dba-8b07-d548f5f29a05"],"failed_gate":"fresh_db_cache_on_reopen","logical_result_exact":true,"poisoned_reopen_seconds":0.000058541},"telemetry":{"otlp_http":true,"signals":["logs","metrics","traces"]},"learned":"The original Phase 0 timing blended close writes with recovery and is superseded. With corrected boundaries, 1 MiB and 8 MiB reopen are metadata-bounded, but the 64 MiB open reads 210,773,938 bytes before the first point lookup. This crosses RFC-0022's stop threshold for the untuned SlateDB incumbent. It does not falsify objectKV; it requires one bounded SlateDB layout and compaction pass before replacing that incumbent."}
{"schema_version":1,"recorded_at":"2026-08-26T06:52:10Z","kind":"diagnostic","lane":"strict-serializability","hypothesis":"A centralized Cell v0 OCC resolver can emit product-shaped point and range histories that are strict serializable in commit-version order, while an independent oracle detects point conflicts, range phantoms, partial effects, incomplete conflict coverage, and stale read versions.","candidate_commit":"a56442ad800deedd72a404a0886e88831eb308a0+dirty","suite":"strict-serializability-v1","suite_hash":"f9422786902f8d6f55de6fbe549e51d5d06d4e5fbf06704a8e806c548bc45879","profile":"model-dev","backend":"cell-v0-resolver-model","seeds":[1103,2207,3301,4409,5519],"run_id":"9664d42e-f7eb-4bcc-927f-6152d6958733","verdict":"inconclusive","primary_metric":{"name":"okv.eval.correctness.anomalies","samples":[0.0,0.0,0.0,0.0,0.0],"median":0.0,"mad":0.0},"hard_gates":"all_passed","budget":{"kind":"events","limit":5000,"observed":5000},"secondary_metrics":{"transactions":5000,"committed":3414,"aborted":1586,"multi_range_committed":2789,"point_reads":7500,"range_reads":1250},"negative_controls":{"all_discarded":true,"run_ids":["3dd2bced-a1cd-442f-a842-22bf2f4fe5ac","ea2a50fd-88ff-4af2-8f1d-10b94fb4812a","3ac38f96-1592-4143-8769-68b20fbc0b86","3bbccdc6-9e6f-4eb8-89d8-6fc1d49662fa","cc388890-7076-40f5-8b07-8c05555910a6","d0aef66d-29b7-4c90-8680-6f8d9dbde5e7"],"classes":["read_write_conflict","range_phantom","atomicity","read_conflict_coverage","write_conflict_coverage","real_time_order"]},"semantic_receipts":{"diagnostic_receipt_sha256":"312f3003a05b054a8cd744de4f85e55acc36bfb3d023bc2b8ee5b2cbecc19514"},"learned":"The transaction contract can now be checked independently at the centralized model boundary. This does not prove the OpenRaft process path, resolver partitioning, commit recovery, or a clean reproducible candidate. Feed the same frozen history schema from the real process client next."}
{"schema_version":1,"recorded_at":"2026-08-26T07:15:37Z","kind":"diagnostic","lane":"replicated-strict-serializability","hypothesis":"One three-node OpenRaft data group can deterministically enforce Cell v0 point and range conflicts, atomic multi-range mutation, lost-reply outcome recovery, exact retry, and restarted-replica state reconstruction while feeding an independent strict-serializability oracle.","candidate_commit":"a56442ad800deedd72a404a0886e88831eb308a0+dirty","suite":"strict-serializability-process-v1","suite_hash":"e19c90ff544c544eb222c1b642ac673b66306e9534111f2cd3cf6ca1ce7ffefc","profile":"local-fs","backend":"process-openraft+transaction-authority","seeds":[1103,2207,3301],"run_id":"5943479a-9c57-4c6b-9ca7-74a86497924b","verdict":"inconclusive","primary_metric":{"name":"okv.eval.correctness.anomalies","samples":[0.0,0.0,0.0],"median":0.0,"mad":0.0},"hard_gates":"all_passed","budget":{"kind":"events","limit":30,"observed":30},"secondary_metrics":{"transactions":18,"committed":12,"aborted":6,"multi_range_committed":9,"point_reads":18,"range_reads":6,"process_starts":12,"process_kills":3,"elections":6,"dropped_replies":3,"recovered_outcomes":3,"final_state_equal":true,"exact_replay":true,"operation_duration_median_seconds":5.8040755},"negative_controls":{"all_discarded":true,"run_ids":["8511ddf4-3d16-4a10-a0da-8221c36a143a","7fcb04d4-c8e9-4cb2-bc79-2d835f779a32"],"classes":["read_write_conflict","atomicity"],"anomaly_samples":[[3.0,3.0,3.0],[3.0,3.0,3.0]]},"semantic_receipts":{"correct_sha256":"1c3eacb4f4e6b1d5c2ecc8648c102ba542a26a2c37ae3724e7d58c8f606bb756","accept_conflicts_sha256":"17ca1fdf3970c38e9bc73c681a441d9df186bad78e0eb6d48601583fed40f651","partial_apply_sha256":"ec2255202cb7f8ac86d78734bd75dddc20d5275aa18459c9f82ff9d398abb2da"},"learned":"The process composition is semantically viable at the single-group same-machine boundary. The gate exposed an invalid non-empty binary-key JSON map in transaction status and snapshot state; canonical ordered entry arrays plus a backward-compatible empty-map decoder repaired the owning storage contract. Clean admission, automatic elections, bounded conflict retention, snapshot installation, independent failure domains, multi-group coordination, and performance remain open."}
{"schema_version":1,"recorded_at":"2026-08-26T07:50:53Z","kind":"diagnostic","lane":"elastic-cold-point","hypothesis":"A separately cacheable sparse row-object index can make exact cold point reads use one bounded data range GET without LIST or complete-object scanning.","candidate_commit":"a56442ad800deedd72a404a0886e88831eb308a0+dirty","suite":"objectkv-product-thesis-physical-v1","suite_hash":"358b0d06651ca4daab59e6830ad84ee9d1d98a586e5d3f979c7048420dd7ff1a","profile":"elastic-dev","profile_hash":"a306088896dc6a4838cd1729501f744092dd370855460c712b84be85fe9749d1","backend":"apache-object-store-local-fs","seeds":[1103,2207,3301],"run_ids":{"candidate":"39889603-e710-4f70-bd4f-780392518516","direct_control":"c9a027cb-b505-4d89-ab67-57e2714dea21","scan_poison":"c09c794c-aa45-4fcd-9d57-cdabf9f164a6"},"verdict":"inconclusive","primary_metric":{"name":"okv.eval.object_store.requests","candidate_per_operation":1.0,"control_per_operation":1.0,"poison_full_gets_per_operation":1.0},"hard_gates":{"candidate":"all_passed","control":"all_passed","scan_poison":"discarded","semantic_correctness_preserved":true},"budget":{"kind":"operations","limit":10000,"candidate_observed":7500,"control_observed":7500,"poison_observed":3},"secondary_metrics":{"data_object_bytes":68757844,"index_bytes":93210,"blocks":1058,"max_block_bytes":65048,"candidate_bytes_per_operation":65048,"control_bytes_per_operation":65048,"poison_bytes_per_operation":68757844,"candidate_p50_ns":2256042,"candidate_p99_ns":2470917,"control_p50_ns":2202917,"control_p99_ns":2516750,"candidate_p50_over_control":1.0241157519779456,"candidate_p99_over_control":0.9817888149399027,"poison_bytes_over_candidate":1057.0324068380273,"poison_p50_over_candidate":1012.3992040041808},"negative_controls":{"all_discarded":true,"class":"complete_object_scan","failed_gates":["one_indexed_data_range_get","no_complete_object_gets","bounded_row_block_bytes"]},"semantic_receipts":{"candidate_sha256":"d3ec2c12fc609dfc76be5ee5d2e071aff89bf50d4011b38943e4bcb9b83efd5d","control_sha256":"a7f7c36b5545355379a915f44bea652b1a6d0f6ed605a69bf6c2791e1f377601","poison_sha256":"0cd0639d5f80291fe625f608d2b89aaa5e753892ef6e0bdb640680d9e0e9cea5"},"telemetry":{"otlp_http":false,"reason":"dirty local diagnostic"},"learned":"The one-block physical read shape is implementable, and the serving-range checks were within diagnostic noise of the direct indexed reader. A complete-object scan can return exact values while being physically invalid, so semantic correctness and workload admission must remain separate gates. This does not prove scale independence, cloud latency, release performance, concurrency, cost, or the complete MVCC segment algebra."}
{"schema_version":1,"recorded_at":"2026-08-26T07:54:15Z","kind":"diagnostic_supersession","lane":"elastic-cold-point","supersedes_recorded_at":"2026-08-26T07:50:53Z","supersession_reason":"The same turn corrected the RAM control profile and added RFC-0003 to the suite contract, changing the suite hash before final receipts were frozen.","hypothesis":"A separately cacheable sparse row-object index can make exact cold point reads use one bounded data range GET without LIST or complete-object scanning.","candidate_commit":"a56442ad800deedd72a404a0886e88831eb308a0+dirty","suite":"objectkv-product-thesis-physical-v1","suite_hash":"969c65e980a1d72c0d8fd2b2adc31eb64383d776428ba3100cdef6bce52bd232","profile":"elastic-dev","profile_hash":"a306088896dc6a4838cd1729501f744092dd370855460c712b84be85fe9749d1","backend":"apache-object-store-local-fs","seeds":[1103,2207,3301],"run_ids":{"candidate":"dcbc4d57-707a-45bf-9c38-c0b08d81796c","direct_control":"a5e98b01-5ec4-424b-bd6d-9c06073237c0","scan_poison":"0b5db912-2c11-4b9c-9a27-4231c4629763"},"verdict":"inconclusive","primary_metric":{"name":"okv.eval.object_store.requests","candidate_per_operation":1.0,"control_per_operation":1.0,"poison_full_gets_per_operation":1.0},"hard_gates":{"candidate":"all_passed","control":"all_passed","scan_poison":"discarded","semantic_correctness_preserved":true},"budget":{"kind":"operations","limit":10000,"candidate_observed":7500,"control_observed":7500,"poison_observed":3},"secondary_metrics":{"data_object_bytes":68757844,"index_bytes":93210,"blocks":1058,"max_block_bytes":65048,"candidate_bytes_per_operation":65048,"control_bytes_per_operation":65048,"poison_bytes_per_operation":68757844,"candidate_p50_ns":2197625,"candidate_p99_ns":2382750,"control_p50_ns":2197708,"control_p99_ns":2371458,"candidate_p50_over_control":0.9999622333813227,"candidate_p99_over_control":1.0047616276569098,"poison_bytes_over_candidate":1057.0324068380273,"poison_p50_over_candidate":1033.9831636425686},"negative_controls":{"all_discarded":true,"class":"complete_object_scan","failed_gates":["one_indexed_data_range_get","no_complete_object_gets","bounded_row_block_bytes"]},"semantic_receipts":{"candidate_sha256":"b6636962826d723b3f47f79fc85c3caeb6594e14ae3cce868ce0adaed621b42e","control_sha256":"0ed1dfab72ffc93b7af9b323ac2dfb83a9b85e869e9934412ce3816d21d316df","poison_sha256":"ce27766d73a62a7a5f65ebae8d7283c5aae4fb46a7169c100c2a8adcf578090b"},"telemetry":{"otlp_http":false,"reason":"dirty local diagnostic"},"learned":"The one-block physical read shape is implementable, and the serving-range checks were within diagnostic noise of the direct indexed reader. A complete-object scan can return exact values while being physically invalid, so semantic correctness and workload admission must remain separate gates. This does not prove scale independence, cloud latency, release performance, concurrency, cost, or the complete MVCC segment algebra."}
{"schema_version":1,"recorded_at":"2026-08-26T08:14:43Z","kind":"diagnostic_scale","lane":"elastic-cold-point","supersedes_recorded_at":"2026-08-26T07:54:15Z","hypothesis":"Within one bounded range, a content-addressed row-object manifest and bounded data objects can hold each exact cold point read to one indexed data range GET and one block of transferred bytes as the range grows from 1 MiB to 64 MiB.","candidate_commit":"a56442ad800deedd72a404a0886e88831eb308a0+dirty","suite":"objectkv-product-thesis-physical-v1","suite_hash":"2ae0eee3feef7c2149e7a1373467b78dc048c5c922783eeebde28802be5a8bfa","profiles":["elastic-1mib-dev","elastic-8mib-dev","elastic-dev"],"profile_hash":"2135085bd79ad700953df6078b72668d7aa465d1d024b848eb1c4321073f355b","backend":"apache-object-store-local-fs","build":"release","seeds":[1103,2207,3301],"run_ids":{"1mib":{"candidate":"9842bac8-673f-48b5-81d2-4a3c47159b29","direct_control":"93863608-a5b8-4efb-a174-8ffa8084905b","scan_poison":"73a5bfee-b416-4cda-a84d-3c758a422999"},"8mib":{"candidate":"8d539272-ee2b-456a-a278-3af16000862a","direct_control":"43250529-1d37-4e83-a885-a96a42368fc0","scan_poison":"6276ba9f-a838-4d07-b960-8ea61fa9cd56"},"64mib":{"candidate":"c1f21998-aee3-4cbd-8cb4-90b7abd0a12f","direct_control":"033ceb79-e4e1-4d68-ad69-a0ed85152228","scan_poison":"8f73b8ad-abcd-47d4-808e-d87aa632955f"}},"verdict":"inconclusive","primary_metric":{"name":"okv.eval.object_store.requests","candidate_per_operation":[1.0,1.0,1.0],"control_per_operation":[1.0,1.0,1.0],"poison_full_gets_per_operation":[1.0,1.0,1.0]},"hard_gates":{"candidate":"all_passed_at_all_sizes","control":"all_passed_at_all_sizes","scan_poison":"discarded_at_all_sizes","semantic_correctness_preserved":true},"measurements":[{"logical_bytes":1048576,"encoded_data_bytes":1074346,"segments":1,"max_data_object_bytes":1074346,"metadata_bytes":2240,"candidate_bytes_per_operation":63873.12,"candidate_p50_ns":166583,"candidate_p99_ns":214417,"control_p50_ns":169500,"control_p99_ns":215625,"poison_bytes_per_operation":1074346,"poison_p50_ns":2221708},{"logical_bytes":8388608,"encoded_data_bytes":8594748,"segments":3,"max_data_object_bytes":4193503,"metadata_bytes":13807,"candidate_bytes_per_operation":64770.36466666667,"candidate_p50_ns":162708,"candidate_p99_ns":180250,"control_p50_ns":163042,"control_p99_ns":178083,"poison_bytes_per_operation":4193503,"poison_p50_ns":7925292},{"logical_bytes":67108864,"encoded_data_bytes":68757924,"segments":17,"max_data_object_bytes":4193503,"metadata_bytes":104754,"candidate_bytes_per_operation":64889.950666666664,"candidate_p50_ns":166666,"candidate_p99_ns":182292,"control_p50_ns":165959,"control_p99_ns":183542,"poison_bytes_per_operation":4193503,"poison_p50_ns":7944000}],"negative_controls":{"all_discarded":true,"class":"complete_selected_object_scan","failed_gates":["one_indexed_data_range_get","no_complete_object_gets","bounded_row_block_bytes"]},"semantic_receipts":{"1mib_candidate_sha256":"933e6a38e12127cbcfe3296224ddbc342a89e14a805f409c0a35304d3726d2fe","1mib_control_sha256":"89da6afe2d80705aa41312a9cd21203f15aa12fd5fc98ff99bd79111c7a9716a","1mib_poison_sha256":"ce1b21673ca8846468345ec53dd0c7d5d140686a967bc71ed26377f85f689e86","8mib_candidate_sha256":"41d79b580787a8be7ede00da88d93e9ac5c48440646704558c80dc2d0ba7e74d","8mib_control_sha256":"f700e33a8fd7e813cf2b90cffc45ad78bafdae071897943ff594d58090d6e4c2","8mib_poison_sha256":"2a0194b590461f361129d6c89c6d42f315c5ab52446d05ebceb693e83b0d913f","64mib_candidate_sha256":"21f9c2c4e1b8daea69c2230cd705b31e54ec68fcc144502fc863356f27f53430","64mib_control_sha256":"3e9bc23fd3a80237ca6901bde85ae07f22d8d926185f07da2bc7640b716f12b4","64mib_poison_sha256":"0b3f3d9e91c10cee073f9ecc7614def005adbe50faea83450c7c6d76c7358e86"},"telemetry":{"otlp_http":false,"reason":"dirty local diagnostic"},"learned":"Partitioning the row base into bounded objects keeps measured data request work and bytes flat through the 64 MiB range profile, and the serving boundary remains within diagnostic noise of the direct indexed reader. Metadata warmup grows with segment count, so range splitting must bound each closure and the empty-worker path must fetch only the selected index before its first read. Cloud latency, concurrency, clean-source reproducibility, OTel, scans, compaction, publication economics, and the complete MVCC segment algebra remain unproven."}
{"schema_version":1,"recorded_at":"2026-08-26T08:36:34Z","kind":"diagnostic_supersession","lane":"empty-worker-recovery","hypothesis":"An empty serving worker can return its first exact point read after one manifest GET, one selected-index GET, and one data range GET without full range hydration.","candidate_commit":"a56442ad800deedd72a404a0886e88831eb308a0+dirty","suite":"objectkv-product-thesis-physical-v1","suite_hash":"9f37becf9dd7d3ae7e574f92dc49d2fecf5ef28b7cae68f13d5534861e378056","profiles":["recovery-1mib-dev","recovery-8mib-dev","recovery-dev"],"backend":"serving-worker-empty-local-fs","build":"release","seeds":[1103,2207,3301],"run_ids":{"1mib":{"candidate":"e255e974-26ac-4322-9725-5900576e8b31","full_restore_control":"98b8ea66-a4ca-4f91-bd67-907fdcb2973d","hydration_poison":"44624736-4bfc-4c80-9e50-e87058d19329"},"8mib":{"candidate":"deb79a29-40e2-40d3-88e5-52dfb8c91305","full_restore_control":"2cc3bc52-a46e-4483-8671-7605bdbba950","hydration_poison":"4e9a55e6-cdcc-4173-9761-9ff4a974b9f9"},"64mib":{"candidate":"ef3eaa19-bec0-4896-a116-ee0e2097df4a","full_restore_control":"2934e85c-4aea-43ca-9484-42122ab57583","hydration_poison":"bee695ef-e540-4e33-97c6-9132347db947"}},"verdict":"superseded","supersession_reason":"The lane selected p99, but the result contract emitted only the median as the primary value. The evaluator was corrected to emit the configured statistic and selected value before the final rerun.","telemetry":{"otlp_http":false,"reason":"dirty local diagnostic"},"learned":"A schema-valid artifact can still report the wrong statistic when the result contract does not bind the lane selector to an emitted value. The configured statistic, selected value, raw samples, median, and MAD must remain distinct fields."}
