{"schema_version":1,"recorded_at":"2026-08-26T15:08:14Z","kind":"diagnostic_state_shape_falsifier","lane":"frontiered-process-snapshot","hypothesis":"Four process cycles aligned on resolver frontier R, a 64-request retry frontier Q(client), and authenticated object frontier O can preserve exact retry and object-plus-suffix recovery while holding complete six-process snapshot plus retained-journal media below 8x one logical copy and cycle-four snapshot bytes below 1.25x cycle one.","candidate_commit":"a56442ad800deedd72a404a0886e88831eb308a0+dirty","suite":"frontiered-process-snapshot-v1","suite_hash":"cbae8831df2ca626a1dd0376621fbc1c9bc29c527867acc0cb695a8ae1449ee3","profile":"local-process","profile_hash":"fbf463766eeea24260e874dd7a48b98dd169a74d6fa05d4ea5a7932cbafdacbf","backend":"local-fs+publication-openraft+data-openraft+frontiered-durable-snapshot","build":"release","seeds":[5601,5602,5603],"run_ids":{"candidate":"be53d36c-5794-4882-9519-714fb1ce1ff6","no_retry_frontier_control":"9b236c46-6e1d-4d32-90dc-0a8eb4da3a99","accounting_poison":"829e35c4-e59e-4f39-9e5e-3d6d80b7bf9e"},"verdict":"discard","decision":"retain_aligned_frontier_protocol_discard_replicated_snapshot_representation_evaluate_manifested_multi_layout_lsm","primary_metric":{"name":"okv.eval.storage.amplification","statistic":"maximum","candidate":19.692718505859375,"samples":[19.68951416015625,19.692718505859375,19.6875],"limit":8.0},"measurements":{"frontier_cycles":4,"data_processes":3,"publication_processes":3,"retry_window":64,"candidate_snapshot_growth_ratio_max":1.0917587172308476,"growth_limit":1.25,"no_retry_frontier_amplification_max":54.803466796875,"no_retry_frontier_growth_ratio_max":2.1959328456860843,"accounting_poison_reported_amplification":0.05364990234375,"accounting_poison_actual_amplification":19.692718505859375,"candidate_batch_commit_p99_seconds_max":0.083336125,"candidate_maintenance_seconds_max":0.296027709},"hard_gates":{"three_data_and_three_publication_processes":"passed","four_complete_frontier_cycles":"passed","authenticated_object_frontier":"passed","resolver_frontier_exact":"passed","retry_window_exact":"passed","expired_retry_rejected":"passed","retained_retry_exact":"passed","durable_snapshot_covers_purge":"passed","journals_reclaimed":"passed","full_quorum_restart_exact":"passed","object_plus_suffix_exact":"passed","snapshot_growth_max_1_25x":"passed","complete_media_max_8x":"failed","no_retry_frontier_control_detected":"passed","accounting_poison_detected":"passed"},"receipts":"docs/artifacts/eval-receipts/frontiered-process-snapshot-g4.11a.1-v1/","telemetry":{"otlp_http":false,"reason":"dirty local diagnostic"},"learned":"Aligned R, Q(client), and O frontiers bound the lifetime curve but do not make the current replicated state representation economical. The no-Q control proves the retry frontier is necessary. Complete-media accounting shows that the remaining problem is the snapshot ownership and encoding constant factor, not retained journal growth. Before independent-media execution, compare compact row, random-access columnar, and multi-layout manifested run shapes against the same point, scan, recovery, and media contracts."}
{"schema_version":1,"recorded_at":"2026-08-26T15:43:02Z","kind":"diagnostic_mechanism_preflight","lane":"storage-layout-fork","hypothesis":"One manifested MVCC history can support exact indexed row, indexed Parquet, and hybrid columnar reads while exposing the point, scan, media, compaction, and branching costs that decide whether columnar compacted runs belong in the objectKV permanent base.","candidate_commit":"a56442ad800deedd72a404a0886e88831eb308a0+dirty","suite":"storage-layout-fork-v1","suite_hash":"427c9bdc0b7a5e0bba0a336aadedc9ffb8272932fc045a355c07a577a194c3aa","profile":"local-preflight","profile_hash":"ad1b6629f7e1e74c966b48891177dc498dffee3e7a14f821d0465c6f5b04af50","backend":"local-fs+observed-range-reads","build":"debug","toolchain":"rustc 1.88.0 (6b00bc388 2025-06-23)","machine":{"os":"Darwin 24.6.0 arm64","cpu":"Apple M4 Max","memory_bytes":51539607552},"seeds":[5701],"run_ids":{},"verdict":"inconclusive","decision":"reject_plain_parquet_as_generic_point_format_continue_random_access_columnar_coalesced_ranges_and_typed_sidecar_subjects","primary_metric":{"name":"okv.eval.object_store.requests","statistic":"per_operation","indexed_row_object":1.0,"indexed_parquet":10.0,"hybrid_columnar":4.0},"measurements":{"keys":1024,"canonical_live_row_bytes":512,"point_operations":256,"canonical_history_sha256":"eb1733278b93990e105c6438d7564988deaba6672e6ea8d6f9ca0f518a3bbb58","row_point_p99_seconds":0.002472708,"parquet_point_p99_seconds":0.044519125,"hybrid_point_p99_seconds":0.030047208,"row_point_response_bytes_per_operation":64066,"parquet_point_response_bytes_per_operation":1047296,"hybrid_point_response_bytes_per_operation":697344,"row_projected_scan_rows_per_second":19148.905368013027,"parquet_projected_scan_rows_per_second":35868.24857646988,"hybrid_projected_scan_rows_per_second":32621.19987585603,"row_storage_amplification":1.5822617392647513,"parquet_storage_amplification":1.5234399135001544,"hybrid_storage_amplification":3.046204046957059,"row_compaction_write_amplification":2.0397125769328706,"parquet_compaction_write_amplification":1.986961625170013,"hybrid_compaction_write_amplification":3.947881279616438},"hard_gates":{"same_canonical_history":"passed","exact_point_results":"passed","exact_ordered_projection":"passed","post_compaction_digest":"passed","no_list_dependency":"passed","checksum_covered_ranges":"passed","complete_media_accounting":"passed","point_never_full_object":"passed","branch_reuses_immutable_runs":"passed","full_frozen_profile":"not_run","release_build":"not_run","gcs":"not_run","vortex":"not_run"},"telemetry":{"otlp_http":false,"reason":"small dirty-tree mechanism preflight"},"learned":"A shared manifested history remains credible, but selected Parquet row groups plus projection are not a competitive generic point path. Parquet improved projected scan throughput 1.873x while multiplying point requests by 10 and bytes by 16.35x. The row-capsule hybrid reduced requests but used 1.925x the row control's stored-to-live media. Continue only with random-access columnar, authenticated request coalescing, or an honestly accounted typed sidecar against the unchanged row control."}
{"schema_version":1,"recorded_at":"2026-08-26T16:11:33Z","kind":"diagnostic_mechanism_admission","lane":"storage-layout-admission","hypothesis":"A manifested run that stores the exact MVCC row capsule once and duplicates only the typed analytical projection can preserve indexed-row point economics while producing a materially faster columnar scan path with bounded durable, compaction, and resident-index amplification.","candidate_commit":"a56442ad800deedd72a404a0886e88831eb308a0+dirty","suite":"storage-layout-admission-v1","suite_hash":"ee5144cd74de848c6a73a3b014d40e247fc80ce14443d073aeafff39dfa9a215","profile":"local-release-admission","profile_hash":"15ca0412b49870a0df3e14bc4eea5572186d7678a5988d8e6a6b70b708fa4fe0","backend":"local-fs+observed-range-reads","build":"release","toolchain":"rustc 1.88.0 (6b00bc388 2025-06-23)","seeds":[5701,5702,5703],"repeats":3,"run_ids":{"split_projection_sidecar_vs_indexed_row":"f5dbba62-0f47-46af-8bb7-d1f7efa6a353"},"verdict":"inconclusive","decision":"admit_split_projection_sidecar_to_clean_gcs_evaluation_keep_indexed_row_as_opaque_default","primary_metric":{"name":"okv.eval.operation.throughput","statistic":"median","candidate_rows_per_second":2867012.177923478,"candidate_samples":[2808887.2993875453,2648849.669082887,2868493.3874254436,2941068.5358092133,2924855.218831472,2668513.1726357583,2884628.0982022313,2329877.4740810557,2867012.177923478],"paired_ratio":9.124075888677071,"minimum_ratio":3.0},"measurements":{"keys":16384,"canonical_live_row_bytes":512,"point_operations_per_sample":4096,"sample_count_per_subject":9,"point_request_ratio_max":1.0,"point_bytes_ratio_max":1.0,"point_p99_ratio":1.03340617188851,"point_p99_ratio_max":1.25,"scan_throughput_ratio":9.124075888677071,"storage_amplification_ratio_max":1.0304037252086014,"compaction_write_amplification_ratio_max":1.0347233067653312,"resident_index_ratio_max":1.1374157479492137,"candidate_point_p99_ns_max":242875,"candidate_point_bytes_per_operation_max":64835.199462890625,"candidate_stored_bytes_max":13498028,"wall_seconds":18.503688958},"hard_gates":{"same_canonical_histories":"passed","exact_point_and_scan_results":"passed","exact_post_compaction_digest":"passed","complete_manifest_closure":"passed","no_list_dependency":"passed","checksum_covered_ranges":"passed","complete_media_accounting":"passed","point_never_full_object":"passed","branch_reuses_immutable_runs":"passed","point_request_ratio_max_1_0":"passed","point_bytes_ratio_max_1_05":"passed","point_p99_ratio_max_1_25":"passed","scan_throughput_ratio_min_3_0":"passed","storage_amplification_ratio_max_1_10":"passed","compaction_write_amplification_ratio_max_1_10":"passed","resident_index_ratio_max_2_0":"passed","budget_240_seconds":"passed","clean_source":"not_run","gcs_cold_and_warm":"not_run","vortex":"not_run"},"telemetry":{"otlp_http":false,"reason":"dirty local diagnostic"},"learned":"The honestly counted split layout passed every frozen local admission gate and is the first credible typed object-run mechanism. It is a multi-layout manifested source of truth, not plain Parquet: exact values and MVCC versions live in the row capsule, while only analytical columns are duplicated. Two isolated outlier runs preceded the frozen alternating nine-sample comparison; backend timing showed no stable layout-specific penalty, so repeated alternation is now part of the contract. Clean-source reproducibility, real GCS request latency, cold-cache behavior, object economics, Vortex, recovery from the split closure, and DataFusion base-plus-tail execution remain unproven."}
{"schema_version":1,"recorded_at":"2026-08-26T18:00:23Z","kind":"diagnostic_mechanism_admission","lane":"columnar-range-overlay-admission","hypothesis":"A permanent columnar MVCC layout with a compact resident key-range index, independently checksummed projection stripes and opaque payload pages, and a bounded disposable RangeEngine cache can preserve exact point and restart semantics while beating indexed row objects on transferred bytes, p99, projected scans, and total media.","candidate_commit":"a56442ad800deedd72a404a0886e88831eb308a0+dirty","suite":"storage-layout-columnar-overlay-v1","suite_hash":"c92826009b7a4b73577cfc7bf28ae031b73f8e063e2a911051ef4cce035fdf90","profile":"local-release-admission","profile_hash":"fc33b5a08b5cc1afbc0839f201d8a21ad5ed1dfd8476a85b47298e96d59a2324","backend":"local-fs+observed-range-reads","build":"release","toolchain":"rustc 1.88.0 (6b00bc388 2025-06-23)","seeds":[5701,5702,5703],"repeats":3,"run_ids":{"columnar_range_overlay_vs_indexed_row":"49d6cd06-28e6-4aee-ac5b-bf8f105f53e0"},"verdict":"inconclusive","decision":"admit_columnar_range_overlay_to_datafusion_provider_and_gcs_gates_keep_split_sidecar_as_remote_latency_fallback","primary_metric":{"name":"okv.eval.operation.throughput","statistic":"median","candidate_rows_per_second":1445133.6357613718,"paired_ratio":4.717783009706996,"minimum_ratio":3.0},"measurements":{"keys":16384,"canonical_live_row_bytes":512,"point_operations_per_sample":4096,"sample_count_per_subject":9,"point_request_ratio_max":1.982421875,"point_bytes_ratio_max":0.35311573588220746,"point_p99_ratio":0.8388493150684931,"scan_throughput_ratio":4.717783009706996,"storage_amplification_ratio_max":1.0095362258431806,"compaction_write_amplification_ratio_max":1.009549265607739,"resident_index_ratio_max":1.1698625842520507,"candidate_point_p99_ns_max":198500,"candidate_point_bytes_per_operation_max":22875.570068359375,"candidate_stored_bytes_max":13224353,"warm_point_requests_total":0,"warm_point_p99_ns_max":1042,"scan_opaque_payload_bytes_total":0,"overlay_resident_bytes_max":13186555,"overlay_capacity_bytes":16777216,"restart_requests_max":961,"restart_response_bytes_max":13247531,"wall_seconds":19.001379667},"hard_gates":{"same_canonical_histories":"passed","exact_point_and_scan_results":"passed","exact_post_compaction_digest":"passed","complete_manifest_closure":"passed","no_list_dependency":"passed","checksum_covered_ranges":"passed","complete_media_accounting":"passed","point_never_full_object":"passed","warm_overlay_zero_object_requests":"passed","projected_scan_zero_opaque_payload_bytes":"passed","empty_overlay_restart_exact":"passed","overlay_cache_byte_bound":"passed","branch_reuses_immutable_runs":"passed","point_request_ratio_max_2_0":"passed","point_bytes_ratio_max_0_50":"passed","point_p99_ratio_max_2_0":"passed","scan_throughput_ratio_min_3_0":"passed","storage_amplification_ratio_max_1_05":"passed","compaction_write_amplification_ratio_max_1_10":"passed","resident_index_ratio_max_2_0":"passed","budget_240_seconds":"passed","clean_source":"not_run","gcs":"not_run","datafusion_provider":"not_run"},"telemetry":{"otlp_http":false,"reason":"dirty local diagnostic"},"learned":"The HANA-like mechanism is locally credible: one durable columnar base can serve exact MVCC points through a compact key-to-stripe index, stream projections without opaque values, rebuild after discarding all serving state, and stay near row-object media. The unresolved risk moved from local format mechanics to remote two-request latency, cache eviction under a larger working set, concurrent L1 and L2 merge semantics, and direct Arrow/DataFusion execution."}
{"schema_version":1,"recorded_at":"2026-08-26T20:05:02Z","kind":"diagnostic_mechanism_admission_with_payload_io_falsifier","lane":"columnar-range-datafusion-source","hypothesis":"A custom DataFusion source can execute exact projected SQL directly over the C5 columnar object while using point-sized logical stripes, bounded coalesced scan range GETs, incremental Arrow batches, and zero opaque payload reads.","candidate_commit":"a56442ad800deedd72a404a0886e88831eb308a0+dirty","suite":"columnar-range-datafusion-coalesced-v1","suite_hash":"082b8782c4c0566857b14f08562ce4c46d503edf0a3b8716fb4ae0facebf73a1","profile":"local-fs","profile_hash":"567d9971abfb1ee02bd528c4c2a56be0dbdeb13a521ce072a3aecff598155a9e","backend":"datafusion+local-fs-range-stripes","build":"release","toolchain":"rustc 1.88.0 (6b00bc388 2025-06-23)","seeds":[5701,5702,5703],"repeats":3,"run_ids":{"coalesced_256k_candidate":"a7d4f3bf-79bc-4d8e-a67f-333f9bcffc5c","single_stripe_control":"d788c75f-c070-4850-b313-60d7ef2135bb","payload_prefetch_poison":"b4fe7c11-9568-4829-b85f-0bedfbfe06ed"},"verdict":"inconclusive","decision":"retain_dual_granularity_point_stripes_and_coalesced_scan_ranges_admit_to_exact_live_tail_and_gcs_gates","primary_metric":{"name":"okv.eval.operation.throughput","statistic":"median","candidate_rows_per_second":2543551.808061989,"control_rows_per_second":1246834.577420939,"paired_ratio":2.0400074349263657},"measurements":{"keys":16384,"samples_per_subject":9,"candidate_projection_requests":54,"control_projection_requests":1761,"request_ratio":0.030664395229982964,"candidate_projection_bytes":13687710,"control_projection_bytes":13687710,"candidate_peak_fetch_bytes":257506,"candidate_peak_arrow_batch_bytes":1646,"candidate_payload_requests":0,"poison_payload_requests":1761,"poison_object_requests":1815,"poison_object_bytes":40736670,"poison_rows_per_second":820215.2160618323},"hard_gates":{"exact_sql_aggregate":"passed","projection_pushdown_reaches_source":"passed","one_incremental_batch_per_stripe":"passed","coalesced_range_nested_checksums":"passed","bounded_fetch_buffer":"passed","bounded_arrow_batch":"passed","no_full_object_reads":"passed","no_list_dependency":"passed","zero_payload_reads":"passed","payload_prefetch_poison_detected":"passed","budget_60_seconds":"passed","clean_source":"not_run","otel":"not_run","exact_base_plus_live_tail":"not_run","gcs":"not_run"},"telemetry":{"otlp_http":false,"reason":"dirty local diagnostic"},"learned":"The direct DataFusion path works, but point-sized stripes alone create unacceptable remote scan request amplification. Bounded 256 KiB scan coalescing reduced projection requests by 32.61x, doubled local SQL throughput, and preserved exact per-stripe checksum validation and small Arrow batches. Payload prefetch is independently visible and costly. The remaining architecture risks are exact live-tail invalidation, complete-query memory, parallel range scheduling, and real GCS latency."}
{"schema_version":1,"recorded_at":"2026-08-26T20:43:23Z","kind":"diagnostic_cache_admission_ablation","lane":"columnar-cache-post-scan-hit-ratio","hypothesis":"At 20 percent cache coverage and Zipf alpha 1.4, bounded ghost two-chance admission preserves the reusable point hot set across a full projected scan better than full admission while preserving exact MVCC results and the byte capacity bound.","candidate_commit":"a56442ad800deedd72a404a0886e88831eb308a0+dirty","suite":"columnar-cache-admission-v1","suite_hash":"8bf208d2be3e6b9b1f2da6ee923c8558fa73dc3291f19310665a9d17f3e8ea78","profile":"local-fs","profile_hash":"cbae9804563b0a96f4fe6d92f3ec80a2890c398d47b585ce68613256c0ce5d59","backend":"columnar-cache+local-fs-range-stripes","build":"release","toolchain":"rustc 1.88.0 (6b00bc388 2025-06-23)","seeds":[5701,5702,5703],"repeats":3,"run_ids":{"full_admit":"7e6ef594-e282-4f38-9fa9-89768bdef381","ghost_two_chance":"3fc51538-7237-41df-8d8e-547004c9ba9f"},"verdict":"inconclusive","decision":"retain_ghost_two_chance_as_the_cache_policy_candidate_expand_ratio_skew_phase_and_durability_curves","primary_metric":{"name":"okv.eval.cache.hit_ratio","statistic":"median","full_admit":0.71337890625,"ghost_two_chance":0.74462890625,"absolute_improvement":0.03125},"measurements":{"cache_ratio_percent":20,"zipf_alpha":1.4,"full_admit_post_scan_requests":8829,"ghost_post_scan_requests":7398,"post_scan_request_reduction_fraction":0.1620795107033639,"full_admit_wall_seconds":2.733740833,"ghost_wall_seconds":2.498125583},"hard_gates":{"point_results_are_exact":"passed","cache_capacity_is_bounded":"passed","scan_pollution_is_exercised":"passed","admission_state_matches_policy":"passed","trace_is_repeatable":"passed","schema_valid":"passed","budget_must_hold":"passed"},"receipts":"docs/artifacts/eval-receipts/cloudjump-cache-admission-2026-08-26/","telemetry":{"otlp_http":false,"reason":"dirty local diagnostic"},"learned":"Cache policy is a material part of the C5 serving architecture. Ghost two-chance pays more misses during scan pollution but preserves the reusable point hot set and reduces subsequent object requests. This does not replace the required full cache-ratio, skew, phase-shift, concurrent-request, publication-debt, and recovery matrix."}
{"schema_version":1,"recorded_at":"2026-08-26T20:42:56Z","kind":"diagnostic_real_gcs_cache_admission_canary","lane":"columnar-cache-post-scan-hit-ratio","hypothesis":"The CloudJump-inspired ghost two-chance effect remains observable through the real GCS adapter and namespaced immutable C5 media on a bounded one-seed canary.","candidate_commit":"a56442ad800deedd72a404a0886e88831eb308a0+dirty","suite":"columnar-cache-admission-gcs-v1","suite_hash":"b1952a71c2d15416568ace8d22b06e565afcb441ccd1375d7717b2f8ec237c36","profile":"objectkv-dev-gcs-canary","profile_hash":"67f9d781d106623e987b08ed130535845b3557bbdb1352e0326a894eee0b457a","backend":"columnar-cache+gcs-range-stripes","gcp_project":"doss-objectkv-dev","gcs_bucket":"doss-objectkv-dev-okv-evals","gcs_region":"us-central1","build":"release","toolchain":"rustc 1.88.0 (6b00bc388 2025-06-23)","seeds":[5701],"repeats":1,"run_ids":{"full_admit":"8574f64c-e33b-4767-b1c6-301475b1d7bf","ghost_two_chance":"a1c6be8a-7776-4107-955f-3274dd6e2d5a"},"verdict":"inconclusive","decision":"retain_bounded_gcs_canary_expand_only_after_parallel_request_and_otel_instrumentation","primary_metric":{"name":"okv.eval.cache.hit_ratio","statistic":"median","full_admit":0.3203125,"ghost_two_chance":0.421875,"absolute_improvement":0.1015625},"measurements":{"keys":512,"point_operations":128,"cache_ratio_percent":20,"zipf_alpha":1.4,"full_admit_post_scan_requests":161,"ghost_post_scan_requests":128,"post_scan_request_reduction_fraction":0.20496894409937888,"full_admit_pollution_requests":37,"ghost_pollution_requests":68,"full_admit_wall_seconds":75.062350667,"ghost_wall_seconds":67.140486459},"hard_gates":{"point_results_are_exact":"passed","cache_capacity_is_bounded":"passed","scan_pollution_is_exercised":"passed","admission_state_matches_policy":"passed","trace_is_repeatable":"passed","schema_valid":"passed","budget_must_hold":"passed"},"receipts":"docs/artifacts/eval-receipts/cloudjump-cache-admission-2026-08-26/","telemetry":{"otlp_http":false,"reason":"dirty one-seed GCS canary"},"learned":"The objectKV GCS adapter and namespaced C5 layout execute end to end, and admission policy changes remote request and latency cost. The earlier 16,384-key nine-repeat serial profile was stopped after five minutes at its first sample, showing that the full cloud curve needs concurrent scheduling and a bounded canary before scale. Clean source, OTel, multiple seeds, larger dataset-to-cache ratios, phase shifts, authority conformance, and an all-fast-tier same-durability control remain open."}
