{"schema_version":1,"recorded_at":"2026-08-30T05:27:56Z","kind":"bounded_real_infra_rfc0047_provider_v2_tail_diagnostic","lane":"native-resident-cache-pressure","hypothesis":"Sparse provider-v2 history removes resident image duplication and reveals whether the retained 1 GiB Zipf 1.4 tail gap is broad overhead or localized to one percentile boundary.","candidate_commit":"077b0062e5877b12c007b7efeeb7726f51006964","source_bundle_sha256":"3f57947b171048aa9501f00b70f39b199787d6d8465d94a5c3760a426bdfd53c","binary_sha256":"9e10bed490b3fa0837abbe732dcb8708ad334a596c3b34588c9cc6c16fa0c802","machine_receipt_sha256":"f81ca98e310153b423ff539b00aade8cce2357d12d4737afe29492e58b85b834","preflight_plan_sha256":"e60b899c4febfe4f56e14daae23befe0316a894ff7ada4344b9a5b5654a7ab14","preflight_receipt_sha256":"ca92d5711708b6b146a92e48992dd8df2b7811a368a7273565faa97bf9ae8768","admission_plan_sha256":"29609ab311a1c28a8459e9c0c8b78ffd471054045e24a9069d5940065fbd4c28","provider":"rocksdb-11.8.1-native-resident-v2","profile":"gcp-r0-nvme-1gib-c50-zipf14-seed3301","subjects":{"native_processes":5,"direct_rocksdb_processes":5},"verdict":"defer","decision":"verify_v2_physical_footprint_keep_row1_evaluating_defer_full_tail_replay_activate_t28_gcs_cold_point","measurements":{"native_local_bytes":1099216389,"control_local_bytes":1099175740,"local_bytes_ratio":1.000036981,"latency_us":{"p50":{"native":3.604,"control":3.514,"ratio":1.025611838},"p95":{"native":6.633,"control":5.865,"ratio":1.130946292},"p99":{"native":64.574,"control":37.074,"ratio":1.741759724},"p99_9":{"native":200.734,"control":194.491,"ratio":1.032099172}}},"hard_gates":{"v2_1_local_footprint":"passed","complete_v2_2_stratum":"not_executed","tail_p99_admission":"not_admitted","otel_preflight_logs_metrics_traces":"passed"},"receipts":"docs/artifacts/eval-receipts/rfc0047-resident-v2-preflight-tail-diagnostic-gcp-r0-2026-08-30/","durable_receipts":"gs://doss-objectkv-dev-okv-evals/runs/rfc0047-resident-v2-20260830/evidence/rfc0047-v2-preflight-tail-diagnostic-077b006.tgz","operations":{"partial_positions_preserved":10,"in_progress_scratch_bytes_deleted":1099216389},"learned":"Provider v2 fixed the 2x local-footprint defect. P50, p95, and p99.9 remain close to direct RocksDB while p99 is 1.742x, which localizes but does not explain the tail issue. Preserve the unchanged gate, instrument hit/miss attribution later, and evaluate cold object reads now."}
{"schema_version":1,"recorded_at":"2026-08-30T06:11:08Z","kind":"bounded_real_infra_rfc0046_t28_point_preflight","lane":"gcs-cold-indexed-point","hypothesis":"The existing 1 GiB generation-pinned fixture can serve an exact point through one at-most-64-KiB GCS data range, and the candidate and raw control can share the same sealed range and unchanged value oracle.","candidate_commit":"8c0b39a","plan_builder_commit":"cb1e44c","fixture_envelope_sha256":"768e1a9b8ee91a16615dd69b89d15ba581667a9d5ab6e5190b5de663efcc024d","descriptor_generation":"1788020925446068","plan_semantic_sha256":"de0f47c6a70a2864abfce351ead127e951c264b34e6553cad48dfc39d6b8274b","profile":"gcp-r0-1gib-metadata-warm-data-cold-single-pair","backend":"generation-pinned-gcs-range-read","subjects":{"candidate":1,"raw_range_control":1},"verdict":"keep","decision":"verify_single_range_mechanism_keep_row2_evaluating_finish_t28_admission_runner","measurements":{"planned_points":5,"minimum_block_bytes":55607,"maximum_block_bytes":65048,"candidate":{"elapsed_ms":49.220085,"response_bytes":65048,"provider_attempts":1,"correctness_anomalies":0},"raw_range_control":{"elapsed_ms":36.172186,"response_bytes":65048,"provider_attempts":1,"correctness_anomalies":0},"single_pair_latency_ratio":1.360720149},"hard_gates":{"exact_value":"passed","shared_sealed_range":"passed","data_range_bytes_at_most_65536":"passed","one_provider_attempt_per_subject":"passed","no_list_in_measured_window":"passed","fresh_process_paired_blocks":"not_executed","read_only_iam_attestation":"not_executed","otel_logs_metrics_traces":"not_executed","performance_admission":"not_admitted"},"receipts":"docs/artifacts/eval-receipts/rfc0046-t28-point-preflight-gcp-r0-2026-08-30/","durable_receipts":"gs://doss-objectkv-dev-okv-evals/runs/rfc0046-t28-preflight-r0-20260830/","learned":"The existing immutable row-object geometry satisfies the frozen 64 KiB data-range ceiling and both subjects cross the same real GCS range boundary with exact results. The single 1.361x latency ratio is diagnostic only; the 15 paired blocks, IAM attestation, poisons, and OTel receipt remain required before the object tier enters the recurring performance figure."}
