{"schema_version":1,"recorded_at":"2026-08-27T05:42:18Z","kind":"diagnostic_integrated_kernel_admission","lane":"single-range-kernel","hypothesis":"The public okv::SingleRange boundary can commit through the replicated transaction authority, preserve every retained record when pagination ends inside a shared commit version, serve exact object-base-plus-tail reads, and recover in a distinct empty process after the first process is killed.","candidate_commit":"a56442ad800deedd72a404a0886e88831eb308a0+dirty","suite":"single-range-kernel-v1","suite_hash":"9a214673398bb44c7be3fe8770c713458867dd6384a00affbd6aca12f468ad54","profile":"local-fs","profile_hash":"a740977ce6ab040629b35734a314ef2a92a8fc79f0542c4c746a901c1f42c99a","backend":"object-store-local-fs+authority-openraft+data-openraft","build":"debug","toolchain":"rustc 1.88.0 (6b00bc388 2025-06-23)","seeds":[1103],"run_ids":{"integrated_single_range":"74b29fe1-5b46-4cd1-923a-ee548a2f780c"},"verdict":"inconclusive","decision":"retain_public_single_range_composition_advance_to_clean_otel_and_independent_media","primary_metric":{"name":"okv.eval.recovery.first_correct_read_duration","statistic":"p99","seconds":0.123002125},"measurements":{"operation_seconds":1.844010041,"batch_cursor_resumes":5,"txlog_read_requests":7,"txlog_response_bytes":4403,"object_response_bytes":6177,"manifest_requests":1,"index_requests":1,"data_range_requests":1,"data_full_requests":0,"list_requests":0},"hard_gates":{"public_commit_and_local_catchup":"passed","shared_version_cursor":"passed","six_authority_processes":"passed","worker_kill":"passed","distinct_empty_replacement":"passed","exact_set_clear_insert_range_clear":"passed","bounded_object_path":"passed","fresh_process_replay":"passed","schema_valid":"passed","budget_must_hold":"passed","clean_source":"not_run","otel":"not_run","independent_media":"not_run"},"receipts":"docs/artifacts/eval-receipts/single-range-kernel-2026-08-27/","telemetry":{"otlp_http":false,"reason":"dirty single-host diagnostic"},"learned":"The repository now has one application-callable continuous objectKV slice instead of evaluator-only components. Batch-aware recovery is required after RFC-0032, and the one-record page test preserved both same-version items. This is not a complete cell: clean OTel replay, independently durable voters, activation leases, scans, objectification ownership, and multi-range routing remain open."}
{"schema_version":1,"recorded_at":"2026-08-27T06:09:32Z","kind":"diagnostic_integrated_kernel_real_gcs_smoke","lane":"single-range-kernel-gcs-smoke","hypothesis":"The public okv::SingleRange boundary can preserve the exact object-base-plus-txLog recovery equation through a real GCS object backend, a killed serving process, an empty replacement, and required OTel without expanding its bounded named-object read path.","candidate_commit":"a56442ad800deedd72a404a0886e88831eb308a0+dirty","suite":"single-range-kernel-gcs-smoke-v1","suite_hash":"ad4e54fc0631970b5836d8e875250083b9ea6c885abd06f6f94e9e8fa08d6c73","profile":"local-controller-gcs-smoke","profile_hash":"ce31e2412401d6181e14f6dbc358d35f25444d726ddf91654a05fa0ae3a04e63","backend":"object-store-gcs+authority-openraft-local-process+data-openraft-local-process","gcp_project":"doss-objectkv-dev","gcs_bucket":"doss-objectkv-dev-okv-evals","gcs_region":"us-central1","build":"debug-no-symbols","toolchain":"rustc 1.88.0 (6b00bc388 2025-06-23)","seeds":[1103],"repeats":1,"run_ids":{"integrated_single_range_gcs":"6723ce8a-ea92-48d6-8020-60f12575fcb8","adjacent_local_control":"260a5f44-ec3d-4443-ac03-1592aef6b0fb"},"verdict":"inconclusive","decision":"retain_backend_generic_public_single_range_advance_exact_suite_to_clean_machine_bound_r0","primary_metric":{"name":"okv.eval.recovery.first_correct_read_duration","statistic":"p99","seconds":0.756949583},"measurements":{"operation_seconds":7.253939042,"batch_cursor_resumes":5,"txlog_read_requests":7,"txlog_response_bytes":4403,"object_response_bytes":6177,"manifest_requests":1,"index_requests":1,"data_range_requests":1,"data_full_requests":0,"list_requests":0,"gcs_scratch_objects_with_replay":14,"gcs_scratch_bytes_with_replay":84610,"otel_log_records":2,"otel_trace_spans":1,"otel_metric_points":8,"adjacent_local_first_correct_read_seconds":0.108626542},"hard_gates":{"public_commit_and_local_catchup":"passed","shared_version_cursor":"passed","six_authority_processes":"passed","worker_kill":"passed","distinct_empty_replacement":"passed","exact_set_clear_insert_range_clear":"passed","bounded_named_gcs_path":"passed","fresh_process_replay":"passed","otel_required_failure_closed":"passed","otel_logs_metrics_traces":"passed","schema_valid":"passed","budget_must_hold":"passed","clean_source":"not_run","machine_receipt":"not_run","independent_media":"not_run"},"receipts":"docs/artifacts/eval-receipts/single-range-kernel-gcs-2026-08-27/","telemetry":{"otlp_http":true,"collector":"local isolated otel/opentelemetry-collector-contrib:0.157.0"},"learned":"The public single-range composition is backend-generic in practice, not only by trait signature. A real GCS base preserved exact recovery and one-manifest, one-index, one-range, zero-LIST access. Remote latency is material but the current 756.950 ms timer combines process start, three authority reads, txLog catch-up, and object work from an uncontrolled Mac, so the next useful result is request-level spans and repeated matched local/GCS runs on R0, not a larger cell."}
{"schema_version":1,"recorded_at":"2026-08-27T06:43:55Z","kind":"diagnostic_public_kernel_ssd_serving_image","lane":"single-range-ssd-smoke","hypothesis":"A complete immutable object base can activate a bounded disposable RocksDB serving image below the public SingleRange API, preserve exact object-base-plus-txLog semantics after process replacement, and serve a measured steady-state point-read window without object operations.","candidate_commit":"a56442ad800deedd72a404a0886e88831eb308a0+dirty","suite":"single-range-ssd-smoke-v1","suite_hash":"5f402537bb28df9dfb80c49fe07fc778bb1adcf256e7ec4b71e5fffab22381fe","profile":"local-process-rocksdb-smoke","profile_hash":"00ae8ef3180d309ead5ece5173bc0fd1fb5f4cedad54568f37c83067b13f81ce","backend":"object-store-local-fs+authority-openraft+data-openraft+rocksdb-local-fs","build":"debug-system-rocksdb","toolchain":"rustc 1.88.0 (6b00bc388 2025-06-23)","machine":{"architecture":"arm64","device_receipt":null},"seeds":[1103],"repeats":1,"run_ids":{"integrated_single_range_rocksdb":"56535944-86e4-4f31-b1a8-38cce19ea668","rejected_backend_allowlist_preflight":"59a4d177-228d-4563-bc72-681399be44fe"},"verdict":"inconclusive","decision":"retain_provider_neutral_serving_image_advance_ssd_to_clean_optimized_named_device_abba_gate_before_ram","primary_metric":{"name":"okv.eval.operation.throughput","statistic":"median","reads_per_second":824251.9655833591},"measurements":{"keys":256,"value_bytes":128,"activated_records":256,"serving_image_local_bytes":86667,"warmup_reads":10000,"measured_reads":100000,"p99_ns":1583,"post_activation_object_operations":0,"correctness_failures":0,"first_correct_read_seconds":0.193728625,"operation_seconds":2.60609725},"hard_gates":{"exact_object_base_plus_txlog":"passed","six_authority_processes":"passed","worker_kill_and_empty_replacement":"passed","complete_object_closure_verified":"passed","bounded_rocksdb_image":"passed","exact_public_kernel_hot_reads":"passed","post_activation_object_operations_zero":"passed","fresh_process_replay":"passed","schema_valid":"passed","budget_must_hold":"passed","clean_source":"not_run","optimized_build":"not_run","five_sample_abba":"not_run","named_nvme_device_receipt":"not_run","otel":"not_run"},"receipts":"docs/artifacts/eval-receipts/single-range-ssd-smoke-2026-08-27/","telemetry":{"otlp_http":false,"reason":"bounded dirty-tree mechanism diagnostic"},"learned":"The SSD-shaped serving path now functions through the public kernel rather than only in the direct RocksDB prototype. The diagnostic reached 824252 reads/s at 1583 ns p99 with zero object operations after activation. The earlier direct RocksDB diagnostic was about 1.29M reads/s, so the current public path has a roughly 36 percent throughput tax that must be decomposed before admission. No NVMe performance claim is valid until a clean optimized ABBA batch records an explicit provider device."}
{"schema_version":1,"recorded_at":"2026-08-27T06:55:00Z","kind":"evidence_amendment","lane":"single-range-ssd-smoke","amends_run_id":"56535944-86e4-4f31-b1a8-38cce19ea668","evidence":"docs/artifacts/eval-receipts/single-range-ssd-smoke-2026-08-27/local-device.json","finding":"The diagnostic scratch volume /dev/disk3s5 is APFS on physical store disk0s2, backed by the internal APPLE SSD AP1024Z NVMe device. This upgrades the mechanism statement to NVMe-backed, but does not change the inconclusive performance verdict because the build was debug, source was dirty, the dataset was small, and the machine was not load-isolated."}
{"schema_version":1,"recorded_at":"2026-08-27T07:39:52Z","kind":"clean_real_infra_public_kernel_ssd_admission","lane":"single-range-ssd-admission","hypothesis":"After generation-fenced admission from a GCS object base and retained txLog suffix, the public SingleRange RocksDB serving path remains within 20 percent of direct RocksDB throughput and p99 on the same local NVMe machine.","candidate_commit":"19ea46fc4431b7069496618db83af72cbaa1b882","suite":"single-range-ssd-admission-v1","suite_hash":"29a934f775422cc78a5f1729590c92bc6ced40dc41aa5535764797cfe9af90bb","profile":"gcp-r0-nvme","profile_hash":"e41948f9331781d3e5c7f340008abdf09af24f6473b248d0d9ebc16dac79a069","backend":"object-store-gcs+authority-openraft-local-process+data-openraft-local-process+rocksdb-nvme","build":"release","machine":{"runner":"n2-standard-8","cpu_platform":"Intel Cascade Lake","hot_scratch":"375 GiB GCP local SSD, NVMe, ext4","stable_media":"200 GiB pd-ssd","object_store":"regional versioned GCS","receipt_sha256":"287e809f15ce0c57d31213fb031d1ffc8209368fffdd074ab3e2fe4737fbdcc8"},"seeds":[1103,2207,3301],"repeats":5,"run_ids":{"aborted_64m_fixture":"7adcfd0e-a380-4ba0-91e2-2d46da90b951","discarded_cursor_profile":"e58b9651-659e-4057-b015-29f5343f20dd","candidate":"662481a8-4a6e-49a4-bb8a-2dd15085cd09","control":"c571ff45-f2da-445d-8d50-ac452f5fee8e"},"verdict":"worse","decision":"keep_gp3_1_evaluating_run_one_focused_public_read_optimization_cycle_then_rerun_or_pivot_serving_base","primary_metric":{"name":"okv.eval.operation.throughput","statistic":"median","candidate":516973.3224033455,"control":702142.2518084684,"candidate_to_control_ratio":0.7362800359497044,"directional_delta_fraction":-0.2637199640502956,"candidate_samples":15,"control_samples":15},"measurements":{"candidate_p99_ns_median":2482,"control_p99_ns_median":1749,"p99_ratio":1.4190966266437965,"candidate_first_correct_read_seconds_median":0.636936131,"candidate_object_response_bytes_median":4304004,"candidate_txlog_response_bytes_median":16741,"candidate_local_bytes":4351739,"control_local_bytes":4347486,"post_activation_object_operations":0,"correctness_anomalies":0,"measured_reads_per_subject":3000000},"hard_gates":{"machine_receipt":"passed","named_local_nvme":"passed","otel_logs_metrics_traces":"passed","clean_source_snapshot":"passed","exact_object_base_plus_tail":"passed","retained_stream_cursor":"passed","killed_worker_empty_replacement":"passed","bounded_serving_image":"passed","zero_measured_object_operations":"passed","throughput_within_20_percent":"failed","p99_within_20_percent":"failed"},"receipts":"docs/artifacts/eval-receipts/single-range-ssd-gcp-r0-2026-08-27/","durable_receipts":"gs://doss-objectkv-dev-okv-evals/results/gp31nvme1-r3/","telemetry":{"otlp_http":true,"collector":"otel/opentelemetry-collector-contrib:0.157.0","trace_export_lines":3,"metric_export_lines":3,"log_export_lines":7},"operations":{"build_seconds":1022,"collector_initial_image_pull":"timed_out_then_retried","lease_teardown":"9 resources destroyed","generated_scratch_bytes_deleted":137728128},"learned":"The object-native recovery and zero-object resident-read mechanism works on real GCS plus local NVMe, but the composed public read path is not yet competitive with direct RocksDB. The first optimization target is the 26.37 percent throughput and 41.91 percent p99 tax. The harness also needs reusable frozen fixtures before scale and an executable secondary-metric p99 comparison before the next admission."}
{"schema_version":1,"recorded_at":"2026-08-27T08:34:00Z","kind":"clean_real_infra_public_kernel_ssd_optimization","lane":"single-range-ssd-admission","hypothesis":"Removing repeated manifest location and object-reference cloning from complete-image point reads will bring the public SingleRange path within 20 percent of direct RocksDB throughput and p99.","candidate_commit":"88e221b9d1a593d1e6877ef5de70abdcfa0b23b4","source_bundle_sha256":"37357655888294dea9bb99e82aa2ff1adcf95e479277a90fb34a2f5846bda22d","suite":"single-range-ssd-admission-v1","suite_hash":"5a9c5efdb3a176f95ea10b90e48540afadbb68c0df0624e5b63f126c898b9e76","profile":"gcp-r0-nvme","profile_hash":"e41948f9331781d3e5c7f340008abdf09af24f6473b248d0d9ebc16dac79a069","backend":"object-store-gcs+authority-openraft-local-process+data-openraft-local-process+rocksdb-nvme","build":"release","binary_sha256":"088930b0f4353e1384ed11a1f8b042c969b9857f43612de2e90f7ffb13b1cf95","machine":{"runner":"n2-standard-8","cpu_platform":"Intel Cascade Lake","hot_scratch":"375 GiB GCP local SSD, NVMe, ext4","stable_media":"200 GiB pd-ssd","object_store":"regional versioned GCS","receipt_sha256":"cddbf2fcb8af94479d5c3f0ab3ecb4752e47013a221b2024a3afa529c2ba05ca"},"seeds":[1103,2207,3301],"repeats":5,"run_ids":{"candidate_ab":"cd918886-cd71-49a3-8805-78cc55e4d544","control_ab":"2356155f-899b-4c01-a22a-699039db11d2","control_ba":"4b68c756-afa4-41a2-8210-f73131d30014","candidate_ba":"cec1fc31-97c9-4287-9c01-61cbf8e3b632"},"verdict":"worse","decision":"stop_incremental_wrapper_optimization_design_native_resident_engine_then_pivot_data_plane_if_same_gate_fails","primary_metric":{"name":"okv.eval.operation.throughput","statistic":"median","ab":{"candidate":575498.1059839383,"control":713304.0245269304,"ratio":0.8068061951081992,"directional_delta_fraction":-0.1931938048918008},"ba":{"candidate":573999.3801725092,"control":717362.20150913,"ratio":0.8001528083929912,"directional_delta_fraction":-0.19984719160700876}},"measurements":{"prior_candidate_reads_per_second":516973.3224033455,"mean_candidate_throughput_change_fraction":0.1117570639937231,"ab_candidate_p99_ns":2490,"ab_control_p99_ns":1841,"ab_p99_ratio":1.3525258011950028,"ba_candidate_p99_ns":2427,"ba_control_p99_ns":1867,"ba_p99_ratio":1.299946438136047,"candidate_local_bytes":4351739,"post_activation_object_operations":0,"correctness_anomalies":0,"measured_reads_per_subject_order":3000000},"hard_gates":{"machine_receipt":"passed","named_local_nvme":"passed","otel_logs_metrics_traces":"passed","clean_source_snapshot":"passed","exact_object_base_plus_tail":"passed","retained_stream_cursor":"passed","killed_worker_empty_replacement":"passed","bounded_serving_image":"passed","zero_measured_object_operations":"passed","suite_hash_bound_to_program":"passed","throughput_within_20_percent_ab":"passed","throughput_within_20_percent_ba":"passed","p99_within_20_percent_ab":"failed","p99_within_20_percent_ba":"failed"},"receipts":"docs/artifacts/eval-receipts/single-range-ssd-gcp-r1-2026-08-27/","durable_receipts":"gs://doss-objectkv-dev-okv-evals/results/gp31nvme2-r1/","telemetry":{"otlp_http":true,"collector":"otel/opentelemetry-collector-contrib:0.157.0","trace_export_lines":4,"metric_export_lines":4,"log_export_lines":8,"all_run_ids_in_all_signals":true},"operations":{"lease_teardown":"9 resources destroyed","live_scratch_objects_deleted":96,"local_terraform_cache_bytes_deleted":121634816},"learned":"Repeated manifest routing materially reduced throughput, but it did not explain tail latency. The wrapper now clears throughput by less than one percentage point in each order while p99 remains 30 to 35 percent worse. Move generation, coverage, and closure checks to activation and frontier transitions, materialize the suffix in the resident engine, and test an engine-native lookup before advancing the stack."}
{"schema_version":1,"recorded_at":"2026-08-27T11:16:00Z","kind":"clean_real_infra_native_resident_decision","lane":"single-range-ssd-admission","hypothesis":"A native resident engine that moves generation, range, closure, MVCC, and retained-tail semantics into RocksDB can remain within 20 percent of an owned-value direct RocksDB control for throughput and p99 while preserving exact object-base-plus-txLog recovery.","candidate_commit":"3c4cae96fe77104830a641b8429ace82391e0533","source_bundle_sha256":"2b92692d4e6c141e7db00ed1ab91289b110140899f0a5c41183cb6f7a9b2f356","suite":"single-range-native-resident-admission-v1","suite_hash":"fbeaf139305aa234e54168c8b3eb2ddf468168651744a39b4120012a60f5ca00","profile":"gcp-r0-nvme","profile_hash":"ae536a5789a80f05aaa35b633075620f6bd5c476f59cb46d4c387d9d716e5b5c","backend":"object-store-gcs+authority-openraft-local-process+data-openraft-local-process+rocksdb-native-resident-nvme","build":"release","binary_sha256":"a439facf7b28aceb453857aa5bd7937bc006b26ce5e748e18931ccba76b7b0fb","machine":{"runner":"n2-standard-8","cpu_platform":"Intel Cascade Lake","hot_scratch":"375 GiB GCP local SSD, NVMe, ext4","stable_media":"200 GiB pd-ssd","object_store":"regional versioned GCS","receipt_sha256":"ff5d009d8ecc2f5fe13f743b6ac8dbbfd837b7a4b2780821b59aeae640921024"},"seeds":[1103,2207,3301],"repeats":5,"run_ids":{"candidate_ab":"62f60a9f-8347-495c-8236-3080c9718d1e","control_ab":"5a13f52e-ad54-4991-9a24-76adbefa3f4f","control_ba":"7de5b71e-3dbc-4350-aab5-214759c7bf73","candidate_ba":"135ba4e6-8f85-4d3f-ad01-9b84ad083735"},"verdict":"worse","decision":"stop_custom_resident_transaction_plane_select_tikv_or_foundationdb_preserve_object_lifecycle","primary_metric":{"name":"okv.eval.operation.throughput","statistic":"median","ab":{"candidate":589717.323,"control":701119.356,"ratio":0.841108298},"ba":{"candidate":587198.724,"control":710183.678,"ratio":0.826826575}},"measurements":{"ab_candidate_p99_ns":2226,"ab_control_p99_ns":1839,"ab_p99_ratio":1.210440457,"ba_candidate_p99_ns":2261,"ba_control_p99_ns":1778,"ba_p99_ratio":1.271653543,"candidate_local_bytes_max":13152909,"post_activation_object_operations":0,"correctness_anomalies":0,"measured_reads_per_subject_order":3000000},"hard_gates":{"machine_receipt":"passed","named_local_nvme":"passed","otel_logs_metrics_traces":"passed","clean_source_snapshot":"passed","exact_object_base_plus_tail":"passed","retained_stream_cursor":"passed","killed_worker_empty_replacement":"passed","bounded_serving_image":"passed","zero_measured_object_operations":"passed","throughput_within_20_percent_ab":"passed","throughput_within_20_percent_ba":"passed","p99_within_20_percent_ab":"failed","p99_within_20_percent_ba":"failed"},"receipts":"docs/artifacts/eval-receipts/single-range-native-resident-gcp-r2-2026-08-27/","durable_receipts":"gs://doss-objectkv-dev-okv-evals/results/gp31native1-r2/","telemetry":{"otlp_http":true,"collector":"otel/opentelemetry-collector-contrib:0.157.0","all_run_ids_in_all_signals":true,"records_per_run":{"logs":2,"metrics":1,"traces":1}},"operations":{"lease_teardown":"9 resources destroyed, 0 benchmark resources remain","live_scratch_objects_deleted":288,"local_temp_targets_permanently_deleted":10},"learned":"The native engine preserved exact recovery and zero-object steady-state reads, but it failed the frozen p99 ceiling in both process orders. The result does not justify building a custom distributed transaction plane. Preserve objectKV's log, WAL, object publication, reconstruction, branching, history, and DataFusion projection layers, and select TiKV or FoundationDB for the resident transaction plane before resuming GP3.1."}
